review,uid,title,journal,issue,volume,pages,date,year,authors,keywords,doi,article_no,isi_id,issn,isbn,title_lower
nutrient,WOS:000241233000008,On monoculture and the structure of crop rotations,AMERICAN JOURNAL OF AGRICULTURAL ECONOMICS,4,88,900-914,NOV,2006,"Hennessy, David A.",ethanol jointness | quasi-convexity | rotation algebra | specialization,NA,NA,094IL,0002-9092,NA,on monoculture and the structure of crop rotations
nutrient,WOS:000237867600014,"Corn response to nitrogen rate, row spacing, and plant density in eastern Nebraska",AGRONOMY JOURNAL,3,98,529-535,MAY-JUN,2006,"Shapiro, Charles A. | Wortmann, Charles S.",,10.2134/agronj2005.0137,NA,047GK,0002-1962,NA,"corn response to nitrogen rate, row spacing, and plant density in eastern nebraska"
nutrient,WOS:000294244800019,Fertilizer Source and Tillage Effects on Yield-Scaled Nitrous Oxide Emissions in a Corn Cropping System,JOURNAL OF ENVIRONMENTAL QUALITY,5,40,1521-1531,SEP,2011,"Venterea, Rodney T. | Maharjan, Bijesh | Dolan, Michael S.",,10.2134/jeq2011.0039,NA,811VR,0047-2425,NA,fertilizer source and tillage effects on yield-scaled nitrous oxide emissions in a corn cropping system
nutrient,WOS:000274285100005,"Container and Installation Time Effects on Soil Moisture, Temperature, and Inorganic Nitrogen Retention for an in situ Nitrogen Mineralization Method",COMMUNICATIONS IN SOIL SCIENCE AND PLANT ANALYSIS,13-14,40,2044-2057,NA,2009,"Wienhold, Brian J. | Varvel, Gary E. | Wilhelm, W. W.",Corn | mineralization | nitrogen | Zea mays L.,10.1080/00103620902960575,NA,552JE,0010-3624,NA,"container and installation time effects on soil moisture, temperature, and inorganic nitrogen retention for an in situ nitrogen mineralization method"
nutrient,WOS:000384984200006,"Summer Cover Crops and Lettuce Planting Time Influence Weed Population, Soil Nitrogen Concentration, and Lettuce Yields",HORTTECHNOLOGY,4,26,409-416,AUG,2016,"Kruse, Raymond | Nair, Ajay",allelopathy | biomass | C:N ratio | cowpea | sorghum-sudangrass | sustainable vegetable production | weed suppression,NA,NA,DY3IH,1063-0198,NA,"summer cover crops and lettuce planting time influence weed population, soil nitrogen concentration, and lettuce yields"
nutrient,WOS:000336046300012,Agronomic Comparison of Anhydrous Ammonia Applied with a High Speed-Low Draft Opener and Conventional Knife Injection in Corn,AGRONOMY JOURNAL,3,106,881-892,MAY-JUN,2014,"Woli, Krishna P. | Fernandez, Fabian G. | Sawyer, John E. | Stamper, Joshua D. | Mengel, David B. | Barker, Daniel W. | Hanna, Mark H.",,10.2134/agronj13.0441,NA,AH3SS,0002-1962,NA,agronomic comparison of anhydrous ammonia applied with a high speed-low draft opener and conventional knife injection in corn
nutrient,WOS:000227823700013,Identifying potential soybean management zones from multi-year yield data,COMPUTERS AND ELECTRONICS IN AGRICULTURE,1-3,46,309-327,MAR,2005,"Jaynes, DB | Colvin, TS | Kaspar, TC",yield zones | clustering | soybean | yield variability | terrain | soil electrical conductivity,NA,NA,908XO,0168-1699,NA,identifying potential soybean management zones from multi-year yield data
nutrient,WOS:000231038100025,Cover crop effects on corn yield response to nitrogen on an irrigated sandy soil,AGRONOMY JOURNAL,4,97,1239-1244,JUL-AUG,2005,"Andraski, TW | Bundy, LG",,10.2134/agronj2005.0052,NA,952XA,0002-1962,NA,cover crop effects on corn yield response to nitrogen on an irrigated sandy soil
nutrient,WOS:000417648100005,"Yield and Economic Potential of Spring-Planted, Pea-Barley Forage in Short-Season Corn Double-Crop Systems",AGRONOMY JOURNAL,6,109,2486-2498,NOV-DEC,2017,"Raskin, Daniel | Wells, M. Scott | Grossman, Julie M. | Coulter, Jeffrey A. | Sheaffer, Craig C.",,10.2134/agronj2017.01.0029,NA,FP5GN,0002-1962,NA,"yield and economic potential of spring-planted, pea-barley forage in short-season corn double-crop systems"
nutrient,WOS:000089526200150,Economics of variable rate lime in Indiana,"PROCEEDINGS OF THE FOURTH INTERNATIONAL CONFERENCE ON PRECISION AGRICULTURE, PTS A AND B",NA,NA,1653-1665,NA,1999,"Bongiovanni, R | Lowenberg-DeBoer, J",,NA,NA,BQ79A,NA,0-89118-140-7,economics of variable rate lime in indiana
nutrient,WOS:000273750500042,Dryland Performance of Sweet Sorghum and Grain Crops for Biofuel in Nebraska,AGRONOMY JOURNAL,1,102,319-326,JAN-FEB,2010,"Wortmann, C. S. | Liska, A. J. | Ferguson, R. B. | Lyon, D. J. | Klein, R. N. | Dweikat, I.",,10.2134/agronj2009.0271,NA,545QE,0002-1962,NA,dryland performance of sweet sorghum and grain crops for biofuel in nebraska
nutrient,WOS:000177015800026,The impact of intercropping annual 'Sava' snail medic on corn production,AGRONOMY JOURNAL,4,94,917-924,JUL-AUG,2002,"Smeltekop, H | Clay, DE | Clay, SA",,NA,NA,576QH,0002-1962,NA,the impact of intercropping annual 'sava' snail medic on corn production
nutrient,WOS:000283010600007,Nitrogen balance in and export from agricultural fields associated with controlled drainage systems and denitrifying bioreactors,ECOLOGICAL ENGINEERING,11,36,1558-1566,NOV,2010,"Woli, Krishna P. | David, Mark B. | Cooke, Richard A. | McIsaac, Gregory F. | Mitchell, Corey A.",Bioreactor | Denitrification | Drainage loss | Nitrogen balance | Tile-drain,10.1016/j.ecoleng.2010.04.024,NA,665BS,0925-8574,NA,nitrogen balance in and export from agricultural fields associated with controlled drainage systems and denitrifying bioreactors
nutrient,WOS:000304738200006,Survey of nitrogen fertilizer use on corn in Minnesota,AGRICULTURAL SYSTEMS,NA,109,43-52,JUN,2012,"Bierman, Peter M. | Rosen, Carl J. | Venterea, Rodney T. | Lamb, John A.",N fertilizer | N management | Fertilizer N recovery | N application rates | N application timing | Nitrification inhibitors,10.1016/j.agsy.2012.02.004,NA,951RR,0308-521X,NA,survey of nitrogen fertilizer use on corn in minnesota
nutrient,WOS:A1993MP30200005,FATE OF FERTILIZER-N-15 TO A MAIZE CROP GROWN IN NORTHERN ZAMBIA,ACTA AGRICULTURAE SCANDINAVICA SECTION B-SOIL AND PLANT SCIENCE,4,43,231-237,DEC,1993,"MAPIKI, A | REDDY, GB | SINGH, BR",FERTILIZER USE EFFICIENCY | MAIZE (ZEA MAYS L) | N-LOSSES | N-15 DISTRIBUTION | PLANT N-15 UPTAKE | PLANT N-ASSIMILATION | OXISOIL,NA,NA,MP302,0906-4710,NA,fate of fertilizer-n-15 to a maize crop grown in northern zambia
nutrient,WOS:000343640900042,Threshold Dynamics in Soil Carbon Storage for Bioenergy Crops,ENVIRONMENTAL SCIENCE & TECHNOLOGY,20,48,12090-12098,OCT 21,2014,"Woo, Dong K. | Quijano, Juan C. | Kumar, Praveen | Chaoka, Sayo | Bernacchi, Carl J.",,10.1021/es5023762,NA,AR5RJ,0013-936X,NA,threshold dynamics in soil carbon storage for bioenergy crops
nutrient,WOS:000089526200064,Site-specific nitrogen management of irrigated corn,"PROCEEDINGS OF THE FOURTH INTERNATIONAL CONFERENCE ON PRECISION AGRICULTURE, PTS A AND B",NA,NA,733-743,NA,1999,"Ferguson, RB | Hergert, GW | Schepers, JS | Crawford, CA",,NA,NA,BQ79A,NA,0-89118-140-7,site-specific nitrogen management of irrigated corn
nutrient,WOS:000182997100028,Testing soils and cornstalks to evaluate nitrogen management on the watershed scale,JOURNAL OF ENVIRONMENTAL QUALITY,3,32,1015-1024,MAY-JUN,2003,"Balkcom, KS | Blackmer, AM | Hansen, DJ | Morris, TF | Mallarino, AP",,NA,NA,680UN,0047-2425,NA,testing soils and cornstalks to evaluate nitrogen management on the watershed scale
nutrient,WOS:000177437000042,Nitrogen fertilization for corn production when using LEPA center pivot sprinklers,"NATIONAL IRRIGATION SYMPOSIUM, PROCEEDINGS",NA,NA,357-362,NA,2000,"Lamm, FR | Schlegel, AJ | ASAE | ASAE",sprinkler irrigation | nutrient management | nitrogen application | water use efficiency,NA,NA,BU94E,NA,1-892769-13-1,nitrogen fertilization for corn production when using lepa center pivot sprinklers
nutrient,WOS:000336045700048,Enhanced Efficiency Fertilizers: Effect on Agronomic Performance of Corn in Iowa,AGRONOMY JOURNAL,2,106,771-780,MAR-APR,2014,"Hatfield, Jerry L. | Parkin, Timothy B.",,10.2134/agronj2013.0104,NA,AH3SM,0002-1962,NA,enhanced efficiency fertilizers: effect on agronomic performance of corn in iowa
nutrient,WOS:000172990200038,Estimating spatially variable soil properties for application of crop models in precision farming,TRANSACTIONS OF THE ASAE,5,44,1343-1353,SEP-OCT,2001,"Irmak, A | Jones, JW | Batchelor, WD | Paz, JO",parameter estimation | precision agriculture | crop modeling | soybean | optimization,NA,NA,506UM,0001-2351,NA,estimating spatially variable soil properties for application of crop models in precision farming
nutrient,WOS:000295313100004,"PRODUCTION, ECONOMIC, AND ENERGY LIFE CYCLE ANALYSIS CAN PRODUCE CONTRARY RESULTS FOR CORN USED IN ETHANOL PRODUCTION",JOURNAL OF PLANT NUTRITION,9-11,34,1278-1289,NA,2011,"Mamani-Pati, Francisco | Clay, David E. | Carlson, Gregg | Clay, Sharon A.",energy ratio | energy use efficiency | life cycle analysis | ethanol,10.1080/01904167.2011.580815,NA,825WP,0190-4167,NA,"production, economic, and energy life cycle analysis can produce contrary results for corn used in ethanol production"
nutrient,WOS:000084936500012,Field-scale watershed evaluations on deep-loess soils: III. Rainfall and fertilizer N use efficiencies,JOURNAL OF SOIL AND WATER CONSERVATION,4,54,711-716,NA,1999,"Logsdon, SD | Karlen, DL | Prueger, JH | Kramer, LA",baseflow | crop yield | evaporation | leaching | runoff | water use,NA,NA,277MC,0022-4561,NA,field-scale watershed evaluations on deep-loess soils: iii. rainfall and fertilizer n use efficiencies
nutrient,WOS:000368866600003,Validation of an agroecosystem process model (AGRO-BGC) on annual and perennial bioenergy feedstocks,ECOLOGICAL MODELLING,NA,321,23-34,FEB 10,2016,"Hunt, Natalie D. | Gower, Stith T. | Nadelhoffer, Knute | Lajtha, Kate | Townsend, Kimberly | Brye, Kristofor R.",Agroecosystem process model | AGRO-BGC | Soil organic carbon | Switchgrass | Corn stover | Bioenergy,10.1016/j.ecolmodel.2015.10.029,NA,DB9VU,0304-3800,NA,validation of an agroecosystem process model (agro-bgc) on annual and perennial bioenergy feedstocks
nutrient,WOS:000184028800013,Methodological limitations and N-budget differences among a restored tallgrass prairie and maize agroecosystems,AGRICULTURE ECOSYSTEMS & ENVIRONMENT,1-3,97,181-198,JUL,2003,"Brye, KR | Norman, JM | Gower, ST | Bundy, LG",nitrogen budget | tallgrass prairie | maize | agroecosystems | Wisconsin,10.1016/S0167-8809(03)00067-7,NA,698YU,0167-8809,NA,methodological limitations and n-budget differences among a restored tallgrass prairie and maize agroecosystems
nutrient,WOS:000259787700014,Use of spectral vegetation indices derived from airborne hyperspectral imagery for detection of European corn borer infestation in Iowa corn plots,JOURNAL OF ECONOMIC ENTOMOLOGY,5,101,1614-1623,OCT,2008,"Carroll, Matthew W. | Glaser, John A. | Hellmich, Richard L. | Hunt, Thomas E. | Sappington, Thomas W. | Calvin, Dennis | Copenhaver, Ken | Fridgen, John",Bt corn | remote sensing | Ostrinia nubilalis | European corn borer | resistance,NA,NA,356OO,0022-0493,NA,use of spectral vegetation indices derived from airborne hyperspectral imagery for detection of european corn borer infestation in iowa corn plots
nutrient,WOS:000418220800004,Unmanned Aerial System (UAS)-based phenotyping of soybean using multi-sensor data fusion and extreme learning machine,ISPRS JOURNAL OF PHOTOGRAMMETRY AND REMOTE SENSING,NA,134,43-58,DEC,2017,"Maimaitijiang, Maitiniyazi | Ghulam, Abduwasit | Sidike, Paheding | Hartling, Sean | Maimaitiyiming, Matthew | Peterson, Kyle | Shavers, Ethan | Fishman, Jack | Peterson, Jim | Kadam, Suhas | Burken, Joel | Fritschi, Felix",Remote sensing | Unmanned Aerial System (UAS) | Phenotyping | Data Fusion | Extreme Learning Machine (ELM) | Extreme Learning Machine based Regression (ELR),10.1016/j.isprsjprs.2017.10.011,NA,FQ2XH,0924-2716,NA,unmanned aerial system (uas)-based phenotyping of soybean using multi-sensor data fusion and extreme learning machine
nutrient,WOS:000248586900009,Evaluating and predicting agricultural management effects under tile drainage using modified APSIM,GEODERMA,3,140,310-322,JUL 15,2007,"Malone, R. W. | Huth, N. | Carberry, P. S. | Ma, L. | Kaspar, T. C. | Karlen, D. L. | Meade, T. | Kanwar, R. S. | Heilman, P.",N loading | cover crop | crop rotation | water quality | crop production | modeling,10.1016/j.geoderma.2007.04.014,NA,197WJ,0016-7061,NA,evaluating and predicting agricultural management effects under tile drainage using modified apsim
nutrient,WOS:000406860800013,Yield and Water Quality Impacts of Field-Scale Integration of Willow into a Continuous Corn Rotation System,JOURNAL OF ENVIRONMENTAL QUALITY,4,46,811-818,JUL-AUG,2017,"Zumpf, Colleen | Ssegane, Herbert | Negri, Maria Cristina | Campbell, Patty | Cacho, Julian",,10.2134/jeq2017.02.0082,NA,FC5DC,0047-2425,NA,yield and water quality impacts of field-scale integration of willow into a continuous corn rotation system
nutrient,WOS:000174646200001,Nitrogen farming: Harvesting a different crop,RESTORATION ECOLOGY,1,10,1-10,MAR,2002,"Hey, DL",nitrogen control | wetlands | hypoxia | denitrification | Mississippi River Basin,NA,NA,535LP,1061-2971,NA,nitrogen farming: harvesting a different crop
nutrient,WOS:000388778300003,Nutrient partitioning and stoichiometry in soybean: A synthesis-analysis,FIELD CROPS RESEARCH,NA,200,18-27,JAN,2017,"Tamagno, S. | Balboa, G. R. | Assefa, Y. | Kovacs, P. | Casteel, S. N. | Salvagiotti, F. | Garcia, F. O. | Stewart, W. M. | Ciampitti, I. A.",Soybean | Nutrient stoichiometry | Harvest index | Nitrogen harvest index | Nutrient concentrations,10.1016/j.fcr.2016.09.019,NA,ED3WD,0378-4290,NA,nutrient partitioning and stoichiometry in soybean: a synthesis-analysis
nutrient,WOS:000073951600005,Transport of amino acids with special emphasis on the synthesis and transport of asparagine in the Illinois low protein and Illinois high protein strains of maize,PLANTA,2,205,181-188,JUN,1998,"Lohaus, G | Buker, M | Hussmann, M | Soave, C | Heldt, HW","amino acid | asparagine synthetase phloem | roots | xylem | zea (Illinois Low Protein, Illinois High Protein)",NA,NA,ZR213,0032-0935,NA,transport of amino acids with special emphasis on the synthesis and transport of asparagine in the illinois low protein and illinois high protein strains of maize
nutrient,WOS:000383316400008,Parameterizing GPFARM-Range model to simulate climate change impacts on hydrologic cycle in a subsurface drained pastureland,JOURNAL OF SOIL AND WATER CONSERVATION,5,71,404-413,SEP-OCT,2016,"Chen, S. | Qi, Z.",climate change | GPFARM-Range | Iowa | soil water content | tile drainage,10.2489/jswc.71.5.404,NA,DW0FN,0022-4561,NA,parameterizing gpfarm-range model to simulate climate change impacts on hydrologic cycle in a subsurface drained pastureland
nutrient,WOS:A1994QC62100036,YIELD AND NITROGEN REQUIREMENT OF NO-TILLAGE CORN AS INFLUENCED BY CULTURAL-PRACTICES,AGRONOMY JOURNAL,6,86,1119-1123,NOV-DEC,1994,"ECKERT, DJ | MARTIN, VL",,NA,NA,QC621,0002-1962,NA,yield and nitrogen requirement of no-tillage corn as influenced by cultural-practices
nutrient,WOS:000249466000035,Using cross-validation to evaluate CERES-Maize yield simulations within a decision support system for precision agriculture,TRANSACTIONS OF THE ASABE,4,50,1467-1479,JUL-AUG,2007,"Thorp, K. R. | Batchelor, W. D. | Paz, J. O. | Kaleita, A. L. | DeJonge, K. C.",corn | crop model | cross-validation | decision support system | precision agriculture | spatial variability | yield,NA,NA,210OR,0001-2351,NA,using cross-validation to evaluate ceres-maize yield simulations within a decision support system for precision agriculture
nutrient,WOS:000290679300010,"FIELD AND LABORATORY STUDIES COMPARING NUTRISPHERE-NITROGEN UREA WITH UREA IN NORTH DAKOTA, ARKANSAS, AND MISSISSIPPI",JOURNAL OF PLANT NUTRITION,8,34,1198-1222,NA,2011,"Franzen, David | Goos, R. Jay | Norman, Richard J. | Walker, Timothy W. | Roberts, Trenton L. | Slaton, Nathan A. | Endres, Gregory | Ashley, Roger | Staricka, James | Lukach, John",nitrogen | rice | wheat | fertilizers | soil fertility,10.1080/01904167.2011.558162,NA,765BV,0190-4167,NA,"field and laboratory studies comparing nutrisphere-nitrogen urea with urea in north dakota, arkansas, and mississippi"
nutrient,WOS:000313302900090,"The Western corn rootworm in maize fields: Comparison of two different sex pheromone preparations in the canton Ticino, Romania, and the State of Illinois, USA","MITTEILUNGEN DER DEUTSCHEN GESELLSCHAFT FUR ALLGEMEINE UND ANGEWANDTE ENTOMOLOGIE, BD 18",NA,18,509-+,NA,2012,"Hummel, Hans E. | Mori, K. | Kovalev, B. | Bertossa, M. | Dinnesen, S.",chemical ecology | Diabrotica virgifera virgifera | field bioassay | precision agriculture | sex pheromone | total synthesis,NA,NA,BDH90,0344-9084,*****************,"the western corn rootworm in maize fields: comparison of two different sex pheromone preparations in the canton ticino, romania, and the state of illinois, usa"
nutrient,WOS:000230397500004,Associations between field characteristics and soybean plant performance using canonical correlation analysis,PLANT AND SOIL,1-2,273,39-55,JUN,2005,"Martin, NF | Bollero, G | Bullock, DG",canonical variables | precision agriculture | sensors | spatial analysis,10.1007/s11104-004-6639-1,NA,944AO,0032-079X,NA,associations between field characteristics and soybean plant performance using canonical correlation analysis
nutrient,WOS:000223586200012,Grain composition and productivity of maize hybrids derived from the Illinois protein strains in response to variable nitrogen supply,CROP SCIENCE,5,44,1593-1600,SEP-OCT,2004,"Uribelarrea, M | Below, FE | Moose, SP",,NA,NA,850BP,0011-183X,NA,grain composition and productivity of maize hybrids derived from the illinois protein strains in response to variable nitrogen supply
nutrient,WOS:000410678700025,Soil conditioning affects interactions between native and invasive exotic perennials of semi-natural grasslands,JOURNAL OF APPLIED ECOLOGY,5,54,1526-1533,OCT,2017,"Vink, Stefanie N. | Jordan, Nicholas R. | Aldrich-Wolfe, Laura | Huerd, Sheri C. | Sheaffer, Craig C. | Kinkel, Linda L.",agriculture | facilitation | interspecific interactions | invasive exotics | nitrogen | plant-soil feedback | prairie | restoration | semi-natural grasslands | soil conditioning,10.1111/1365-2664.12823,NA,FG8KB,0021-8901,NA,soil conditioning affects interactions between native and invasive exotic perennials of semi-natural grasslands
nutrient,WOS:000246567400028,Nitrogen response of grain Sorghum in rotation with soybean,AGRONOMY JOURNAL,3,99,808-813,MAY-JUN,2007,"Wortmann, Charles S. | Mamo, Martha | Dobermann, Achim",,10.2134/agronj2006.0164,NA,169BJ,0002-1962,NA,nitrogen response of grain sorghum in rotation with soybean
nutrient,WOS:000372392100029,The Interplay Between Bioenergy Grass Production and Water Resources in the United States of America,ENVIRONMENTAL SCIENCE & TECHNOLOGY,6,50,3010-3019,MAR 15,2016,"Song, Yang | Cervarich, Matthew | Jain, Atul K. | Kheshgi, Haroon S. | Landuyt, William | Cai, Ximing",,10.1021/acs.est.5b05239,NA,DG9GZ,0013-936X,NA,the interplay between bioenergy grass production and water resources in the united states of america
nutrient,WOS:000264311500007,Effect of Nitrogen Application Timing on Corn Production Using Subsurface Drip Irrigation,SOIL SCIENCE,3,174,174-179,MAR,2009,"Tarkalson, David D. | Van Donk, Simon J. | Petersen, James L.",Subsurface drip irrigation | nitrogen | corn,10.1097/SSL.0b013e3181998514,NA,420TG,0038-075X,NA,effect of nitrogen application timing on corn production using subsurface drip irrigation
nutrient,WOS:A1997WL69600020,Assessing corn yield and nitrogen uptake variability with digitized aerial infrared photographs,PHOTOGRAMMETRIC ENGINEERING AND REMOTE SENSING,3,63,299-306,MAR,1997,"Tomer, MD | Anderson, JL | Lamb, JA",,NA,NA,WL696,0099-1112,NA,assessing corn yield and nitrogen uptake variability with digitized aerial infrared photographs
nutrient,WOS:000408179900019,Fate of water and nitrate using drainage water management on tile systems in east-central Illinois,AGRICULTURAL WATER MANAGEMENT,NA,191,218-228,SEP,2017,"Lavaire, Tito | Gentry, Lowell E. | David, Mark B. | Cooke, Richard A.",Tile drainage | Tile nitrate loads | Drainage water management,10.1016/j.agwat.2017.06.004,NA,FE4JJ,0378-3774,NA,fate of water and nitrate using drainage water management on tile systems in east-central illinois
nutrient,WOS:A1995QF62100008,CORN PRODUCTION USING ALTERNATE FURROW NITROGEN-FERTILIZATION AND IRRIGATION,JOURNAL OF PRODUCTION AGRICULTURE,1,8,66-69,JAN-MAR,1995,"HEFNER, SG | TRACY, PW",,NA,NA,QF621,0890-8524,NA,corn production using alternate furrow nitrogen-fertilization and irrigation
nutrient,WOS:A1991EP86300001,ANALYSIS OF INVIVO AND INVITRO GROWN ENDOSPERMS OF HIGH AND LOW PROTEIN STRAINS OF MAIZE,PLANT SCIENCE,1,73,1-9,NA,1991,"BALCONI, C | RIZZI, E | MANZOCCHI, L | SOAVE, C | MOTTO, M",ENDOSPERM DEVELOPMENT | INVITRO CULTURE | STORAGE PROTEINS | ZEINS | ZEA-MAYS L,NA,NA,EP863,0168-9452,NA,analysis of invivo and invitro grown endosperms of high and low protein strains of maize
nutrient,WOS:A1997XB84600013,Nitrogen application methods and timing for corn after soybean in a ridge-tillage system,JOURNAL OF PRODUCTION AGRICULTURE,2,10,300-307,APR-JUN,1997,"Randall, GW | Irgavarapu, TK | Bock, BR",,NA,NA,XB846,0890-8524,NA,nitrogen application methods and timing for corn after soybean in a ridge-tillage system
nutrient,WOS:000375425300028,Nitrogen and Weed Management for Organic Sweet Corn Production on Loamy Sand,AGRONOMY JOURNAL,2,108,758-769,MAR-APR,2016,"West, Jaimie R. | Ruark, Matthew D. | Bussan, Alvin J. | Colquhoun, Jed B. | Silva, Erin M.",,10.2134/agronj2015.0393,NA,DL1XA,0002-1962,NA,nitrogen and weed management for organic sweet corn production on loamy sand
nutrient,WOS:000262483500023,Long-Term Changes in Mollisol Organic Carbon and Nitrogen,JOURNAL OF ENVIRONMENTAL QUALITY,1,38,200-211,JAN-FEB,2009,"David, Mark B. | Mclsaac, Gregory F. | Darmody, Robert G. | Omonode, Rex A.",,10.2134/jeq2008.0132,NA,394WJ,0047-2425,NA,long-term changes in mollisol organic carbon and nitrogen
nutrient,WOS:000330458500021,"Maize Nutrient Accumulation and Partitioning in Response to Plant Density and Nitrogen Rate: II. Calcium, Magnesium, and Micronutrients",AGRONOMY JOURNAL,6,105,1645-1657,NOV-DEC,2013,"Ciampitti, Ignacio A. | Vyn, Tony J.",,10.2134/agronj2013.0126,NA,300IV,0002-1962,NA,"maize nutrient accumulation and partitioning in response to plant density and nitrogen rate: ii. calcium, magnesium, and micronutrients"
nutrient,WOS:000277591600018,Using Active Canopy Sensors to Quantify Corn Nitrogen Stress and Nitrogen Application Rate,AGRONOMY JOURNAL,3,102,964-971,MAY-JUN,2010,"Barker, Daniel W. | Sawyer, John E.",,10.2134/agronj2010.0004,NA,595DT,0002-1962,NA,using active canopy sensors to quantify corn nitrogen stress and nitrogen application rate
nutrient,WOS:000265556700007,"Dairy heifer management impacts manure N collection and cycling through crops in Wisconsin, USA",AGRICULTURE ECOSYSTEMS & ENVIRONMENT,3-4,131,170-177,JUN,2009,"Powell, J. Mark | Russelle, Michael P.",Heifers | Manure | Feces | Urine | Manure management | Nitrogen cycling,10.1016/j.agee.2009.01.012,NA,438LK,0167-8809,NA,"dairy heifer management impacts manure n collection and cycling through crops in wisconsin, usa"
nutrient,WOS:000335399000007,Use of corn height to improve the relationship between active optical sensor readings and yield estimates,PRECISION AGRICULTURE,3,15,331-345,JUN,2014,"Sharma, L. K. | Franzen, D. W.",Canopy sensors | Nitrogen | INSEY,10.1007/s11119-013-9330-9,NA,AG4OG,1385-2256,NA,use of corn height to improve the relationship between active optical sensor readings and yield estimates
nutrient,WOS:000089526200147,Evaluating the economics of precision agriculture,"PROCEEDINGS OF THE FOURTH INTERNATIONAL CONFERENCE ON PRECISION AGRICULTURE, PTS A AND B",NA,NA,1621-1632,NA,1999,"Snyder, C | Havlin, J | Kluitenberg, G | Schroeder, T",,NA,NA,BQ79A,NA,0-89118-140-7,evaluating the economics of precision agriculture
nutrient,WOS:000182261000017,Correcting iron deficiency in corn with seed row-applied iron sulfate,AGRONOMY JOURNAL,1,95,160-166,JAN-FEB,2003,"Godsey, CB | Schmidt, JP | Schlegel, AJ | Taylor, RK | Thompson, CR | Gehl, RJ",,NA,NA,667XW,0002-1962,NA,correcting iron deficiency in corn with seed row-applied iron sulfate
nutrient,WOS:000398720100040,Assessment of Canopy Chlorophyll Content Retrieval in Maize and Soybean: Implications of Hysteresis on the Development of Generic Algorithms,REMOTE SENSING,3,9,,MAR,2017,"Peng, Yi | Nguy-Robertson, Anthony | Arkebauer, Timothy | Gitelson, Anatoly A.",canopy chlorophyll content | reflectance | vegetation index | crop phenology | Sentinel-2,10.3390/rs9030226,NA,ER3SZ,2072-4292,NA,assessment of canopy chlorophyll content retrieval in maize and soybean: implications of hysteresis on the development of generic algorithms
nutrient,WOS:000088545000005,Adoption of precision forming within three Midwest watersheds,JOURNAL OF SOIL AND WATER CONSERVATION,2,55,135-141,NA,2000,"Napier, TL | Robinson, J | Tucker, M",adoption | Midwest precision farming | watershed,NA,NA,340QC,0022-4561,NA,adoption of precision forming within three midwest watersheds
nutrient,WOS:000249222800012,Soil greenhouse gas fluxes and global warming potential in four high-yielding maize systems,GLOBAL CHANGE BIOLOGY,9,13,1972-1988,SEP,2007,"Adviento-Borbe, M. A. A. | Haddix, M. L. | Binder, D. L. | Walters, D. T. | Dobermann, A.",agriculture | C sequestration | global warming potential | intensive cropping systems | maize | nitrous oxide,10.1111/j.1365-2486.2007.01421.x,NA,207AA,1354-1013,NA,soil greenhouse gas fluxes and global warming potential in four high-yielding maize systems
