review,uid,title,journal,issue,volume,pages,date,year,authors,keywords,doi,article_no,isi_id,issn,isbn,title_lower
tillage,WOS:000079958700013,Response of hard red winter wheat to seed density and seeding rate in no-till,JOURNAL OF PRODUCTION AGRICULTURE,1,12,100-104,JAN-MAR,1999,"Sunderman, HD",,NA,NA,190JE,0890-8524,NA,response of hard red winter wheat to seed density and seeding rate in no-till
tillage,WOS:000239189900043,Economic feasibility of no-tillage and manure for soil carbon sequestration in corn production in northeastern Kansas,JOURNAL OF ENVIRONMENTAL QUALITY,4,35,1364-1373,JUL-AUG,2006,"Pendell, Dustin L. | Williams, Jeffery R. | Rice, Charles W. | Nelson, Richard G. | Boyles, Scott B.",,10.2134/jeq2005.0149,NA,065WE,0047-2425,NA,economic feasibility of no-tillage and manure for soil carbon sequestration in corn production in northeastern kansas
tillage,WOS:000236485500009,Long-term effects of spring wheat-soybean cropping systems on weed populations,FIELD CROPS RESEARCH,2-3,97,197-208,JUN 1,2006,"Ramsdale, BK | Kegode, GO | Messersmith, CG | Nalewaja, JD | Nord, CA",Canada thistle | common lambsquarters cropping systems | foxtail | mulch-till | redroot pigweed | rye | seed bank | sweetclover | wheat,10.1016/j.fcr.2005.09.010,NA,028KG,0378-4290,NA,long-term effects of spring wheat-soybean cropping systems on weed populations
tillage,WOS:000251092100014,Regional assessment of soil compaction and structural properties under no-tillage farming,SOIL SCIENCE SOCIETY OF AMERICA JOURNAL,6,71,1770-1778,NOV-DEC,2007,"Blanco-Canqui, Humberto | Lal, R.",,10.2136/sssaj2007.0048,NA,233LJ,0361-5995,NA,regional assessment of soil compaction and structural properties under no-tillage farming
tillage,WOS:000183839500006,Weed management and economic returns in no-tillage herbicide-resistant corn (Zea mays),WEED TECHNOLOGY,2,17,239-248,APR-JUN,2003,"Hellwig, KB | Johnson, WG | Massey, RE",application strategies | application timing | tank mixes,NA,NA,695PM,0890-037X,NA,weed management and economic returns in no-tillage herbicide-resistant corn (zea mays)
tillage,WOS:000407751200005,Ring-necked Pheasant Use of Post-Conservation Reserve Program Lands,RANGELAND ECOLOGY & MANAGEMENT,5,70,569-575,SEP,2017,"Geaumont, Benjamin A. | Sedivec, Kevin K. | Schauer, Christopher S.",CRP | daily survival rate | nest survival | season-long grazing | vertical structure | visual obstruction,10.1016/j.rama.2017.04.003,NA,FD8BW,1550-7424,NA,ring-necked pheasant use of post-conservation reserve program lands
tillage,WOS:A1997XY34100006,Wild carrot (Daucus carota) control in no-tillage cropping systems,WEED TECHNOLOGY,3,11,444-452,JUL-SEP,1997,"Stachler, JM | Kells, JJ","acetochlor, 2-chloro-N-(ethoxymethyl)-N-(2-ethyl-6-methylphenyl)acetamide | atrazine, 6-chloro-N-ethyl-N'-(1-methylethyl)-1,3,5-triazine-2,4-diamine | bentazon, 3-(1-methylethyl)-(1H)-2,1,3-benzothiadiazin-4(3H)-one 2,2-dioxide | CGA-152005, 1-(4-methoxy-6-methyl-triazin-2-yl)-3-[2-(3,3,3-trifluoropropyl)-phenylsulfonyl]-urea | chlorimuron, 2-[[[[(4-chloro-6-methoxy-2-pyrimidinyl)amino]carbonyl]amino]sulfonyl]benzoic acid | clopyralid, 3,6-dichloro-2-pyridinecarboxylic acid | cyanazine, 2-[[4-chloro-6-(ethylamino)-1,3,5-triazin-2-yl]amino]-2-methylpropanenitrile | dichlormid, 2,2-dichloro-N,N-di-2-propenylacetamide | flumetsulam, N-(2,6-difluorophenyl)-5-methyl-[1,2,4]triazolo[1,5-a]pyrimidine-2-sulfonamide | glyphosate, N-(phosphonomethyl)glycine | linuron, N'-(3,4-dichlorophenyl)-N-methoxy-N-methylurea | metribuzin, 4-amino-6-(1,1-dimethylethyl)-3-(methylthio)-1,2,4-triazin-5(4H)-one | MON 12000, methyl 5-[[(4,6-dimethoxy-2-pyrimidinyl)amino]carbonylaminosulfonyl]-3-chloro-1-methyl-1-H-pyrazole-4-carboxylate | nicosulfuron, 2-[[[[(4,6-dimethoxy-2-pyrimidinyl)amino]carbonyl]amino]sulfonyl]-N,N-dimethyl-3-pyridinecarboxamide | primisulfuron, 2-[[[[[4,6-bis(difluoromethoxy)-2-pyrimidinyl]amino]carbonyl]amino]sulfonyl]benzoic acid | 2,4-D, (2,4-dichlorophenoxy)acetic acid | wild carrot, Daucus carota L. #(3) DAUCA | corn, Zea mays L. | soybean, Glycine max (L.) Merr | differential response | resistance | acetochlor | atrazine | bentazon | CGA-152005 | chlorimuron | clopyralid | cyanazine | flumetsulam | glyphosate | linuron | metribuzin | MON 12000 | nicosulfuron | primisulfuron | 2,4-D | Glycine max | Zea mays | DAUCA",NA,NA,XY341,0890-037X,NA,wild carrot (daucus carota) control in no-tillage cropping systems
tillage,WOS:000083839800035,Interaction of tillage and soil texture: Biologically active soil organic matter in Illinois,SOIL SCIENCE SOCIETY OF AMERICA JOURNAL,5,63,1326-1334,SEP-OCT,1999,"Needelman, BA | Wander, MM | Bollero, GA | Boast, CW | Sims, GK | Bullock, DG",,NA,NA,258LC,0361-5995,NA,interaction of tillage and soil texture: biologically active soil organic matter in illinois
tillage,WOS:000361048300026,Stover Harvest and Tillage System Effects on Corn Response to Fertilizer Nitrogen,SOIL SCIENCE SOCIETY OF AMERICA JOURNAL,4,79,1249-1260,JUL-AUG,2015,"Pantoja, Jose L. | Woli, Krishna P. | Sawyer, John E. | Barker, Daniel W. | Al-Kaisi, Mahdi",,10.2136/sssaj2015.01.0039,NA,CR0XZ,0361-5995,NA,stover harvest and tillage system effects on corn response to fertilizer nitrogen
tillage,WOS:A1982PX41200173,HUMAN-CAPITAL INVESTMENTS AND PRODUCTION EFFICIENCY - AN ANALYSIS OF THE ADOPTION OF REDUCED TILLAGE PRACTICES BY IOWA FARM FIRMS,AMERICAN JOURNAL OF AGRICULTURAL ECONOMICS,5,64,1088-1088,NA,1982,"RAHM, MR | HUFFMAN, WE",,NA,NA,PX412,0002-9092,NA,human-capital investments and production efficiency - an analysis of the adoption of reduced tillage practices by iowa farm firms
tillage,WOS:000338718300011,Estimating water quality effects of conservation practices and grazing land use scenarios,JOURNAL OF SOIL AND WATER CONSERVATION,4,69,330-342,JUL-AUG,2014,"Wilson, G. L. | Dalzell, B. J. | Mulla, D. J. | Dogwiler, T. | Porter, P. M.",conservation tillage | cover crops | filter strips | grazing | Soil and Water Assessment Tool | water quality,10.2489/jswc.69.4.330,NA,AK8ZW,0022-4561,NA,estimating water quality effects of conservation practices and grazing land use scenarios
tillage,WOS:000245055100002,Soil carbon dynamics during a long-term incubation study involving C-13 and C-14 measurements,SOIL SCIENCE,3,172,189-208,MAR,2007,"Follett, Ronald F. | Paul, Eldor A. | Pruessner, Elizabeth G.",soil organic carbon | soil microbial biomass | long-term incubation | carbon isotopes | tillage treatments | acid hydrolysis | carbon dioxide,10.1097/ss.0b013e31803403de,NA,148DQ,0038-075X,NA,soil carbon dynamics during a long-term incubation study involving c-13 and c-14 measurements
tillage,WOS:000273067300010,Cost effectiveness of conservation practices in controlling water erosion in Iowa,SOIL & TILLAGE RESEARCH,1,106,71-78,DEC,2009,"Zhou, X. | Al-Kaisi, M. | Helmers, M. J.",Soil erosion | Conservation practices | Economic benefit | Water Erosion Prediction Project model,10.1016/j.still.2009.09.015,NA,536TS,0167-1987,NA,cost effectiveness of conservation practices in controlling water erosion in iowa
tillage,WOS:000166693600005,Interactions of glyphosate with residual herbicides in no-till soybean (Glycine max) production,WEED TECHNOLOGY,3,14,480-487,JUL-SEP,2000,"Vanlieshout, LA | Loux, MM",tank mixtures | CHEAL | ECHCG | POLPY | SETFA,NA,NA,397JY,0890-037X,NA,interactions of glyphosate with residual herbicides in no-till soybean (glycine max) production
tillage,WOS:A1995QV54600020,EARTHWORM COMMUNITY STRUCTURE AND DIVERSITY IN EXPERIMENTAL AGRICULTURAL WATERSHEDS IN NORTHEASTERN OHIO,PLANT AND SOIL,1,170,233-239,MAR,1995,"BOHLEN, PJ | EDWARDS, WM | EDWARDS, CA",EARTHWORMS | CROPPING | BIODIVERSITY | DROUGHT EFFECTS | TILLAGE,NA,NA,QV546,0032-079X,NA,earthworm community structure and diversity in experimental agricultural watersheds in northeastern ohio
tillage,WOS:000250352500005,Control of both winter annual and summer annual weeds in no-till corn with between-row mowing systems,WEED TECHNOLOGY,3,21,591-601,JUL-SEP,2007,"Donald, William W.",alternative weed control | application | banding | band application | cutting | mechanical weed control | nonchemical weed control | decreased herbicide rate,10.1614/WT-05-141.1,NA,223EN,0890-037X,NA,control of both winter annual and summer annual weeds in no-till corn with between-row mowing systems
tillage,WOS:000296727400012,Soybean Phenology Simulation in the North-Central United States,AGRONOMY JOURNAL,6,103,1661-1667,NOV-DEC,2011,"Torrion, Jessica | Setiyono, Tri Deri | Cassman, Kenneth | Specht, James",,10.2134/agronj2011.0141,NA,844DH,0002-1962,NA,soybean phenology simulation in the north-central united states
tillage,WOS:000326357300012,USE OF A SURROGATE TO EVALUATE THE IMPACT OF TILLAGE ON THE TRANSPORT OF STEROID HORMONES FROM MANURE-AMENDED AGRICULTURAL FIELDS,TRANSACTIONS OF THE ASABE,4,56,1379-1385,JUL-AUG,2013,"Biswas, S. | Kranz, W. L. | Shapiro, C. A. | Mamo, M. | Bartelt-Hunt, S. L. | Snow, D. D. | Shelton, D. P. | Tarkalson, D. D. | Mader, T. L. | van Donk, S. J. | Zhang, T. C.",Ethynylestradiol | Manure | Steroid hormone | Surface runoff | Tillage,NA,NA,243ZQ,2151-0032,NA,use of a surrogate to evaluate the impact of tillage on the transport of steroid hormones from manure-amended agricultural fields
tillage,WOS:000089274700005,Long-term corn grain and stover yields as a function of tillage and residue removal in east central Minnesota,SOIL & TILLAGE RESEARCH,3-4,56,167-174,AUG,2000,"Linden, DR | Clapp, CE | Dowdy, RH",no-tillage | moldboard-tillage | chisel-tillage | nitrogen | harvest index | water deficit | Zea mays L. | Minnesota | Haplic Chernozem,NA,NA,353LB,0167-1987,NA,long-term corn grain and stover yields as a function of tillage and residue removal in east central minnesota
tillage,WOS:A1991FK70600006,ECONOMIC-FEASIBILITY OF AGRICULTURAL MANAGEMENT-PRACTICES FOR REDUCING SEDIMENTATION IN A WATER-SUPPLY LAKE,AGRICULTURAL WATER MANAGEMENT,4,19,361-370,MAY,1991,"PRATO, T | DAUTEN, K",,NA,NA,FK706,0378-3774,NA,economic-feasibility of agricultural management-practices for reducing sedimentation in a water-supply lake
tillage,WOS:A1990ET72800014,CROPPING AND TILLAGE OPTIONS TO ACHIEVE EROSION CONTROL GOALS AND MAXIMUM PROFIT ON IRREGULAR SLOPES,JOURNAL OF SOIL AND WATER CONSERVATION,6,45,648-653,NOV-DEC,1990,"JONES, AJ | SELLEY, RA | MIELKE, LN",,NA,NA,ET728,0022-4561,NA,cropping and tillage options to achieve erosion control goals and maximum profit on irregular slopes
tillage,WOS:000266682200005,Long-term tillage effects on soil carbon storage and carbon dioxide emissions in continuous corn cropping system from an alfisol in Ohio,SOIL & TILLAGE RESEARCH,1,104,39-47,JUN,2009,"Ussiri, David A. N. | Lal, Rattan",Carbon sequestration | CO2 flux | No-till | Chisel plow | Moldboard plow | Soil temperature | Corn-derived carbon | US Corn Belt,10.1016/j.still.2008.11.008,NA,454LA,0167-1987,NA,long-term tillage effects on soil carbon storage and carbon dioxide emissions in continuous corn cropping system from an alfisol in ohio
tillage,WOS:000271774400022,Wheat and Sorghum Residue Removal for Expanded Uses Increases Sediment and Nutrient Loss in Runoff,JOURNAL OF ENVIRONMENTAL QUALITY,6,38,2365-2372,NOV-DEC,2009,"Blanco-Canqui, Humberto | Stephenson, R. J. | Nelson, N. O. | Presley, D. R.",,10.2134/jeq2009.0021,NA,519NU,0047-2425,NA,wheat and sorghum residue removal for expanded uses increases sediment and nutrient loss in runoff
tillage,WOS:000085250700012,No-tillage soybean performance in cover crops for weed management in the western Corn Belt,JOURNAL OF SOIL AND WATER CONSERVATION,1,55,79-84,NA,2000,"Williams, MM | Mortensen, DA | Doran, JW",allelopathy | canopy volume | crop residues | fitness | integrated weed management | no-tillage | soil moisture | soil temperature | weather variability,NA,NA,282ZB,0022-4561,NA,no-tillage soybean performance in cover crops for weed management in the western corn belt
tillage,WOS:000356871500079,Tillage effects on quality of organic and mineral soils under on-farm conditions in Ohio,ENVIRONMENTAL EARTH SCIENCES,2,74,1815-1822,JUL,2015,"Mukherjee, A. | Lal, R.",On-farm research | Organic or muck soil | No-till versus conventional tillage | Soil physicochemical characteristics | Long-term versus short-term tillage,10.1007/s12665-015-4189-x,NA,CL3SS,1866-6280,NA,tillage effects on quality of organic and mineral soils under on-farm conditions in ohio
tillage,WOS:000284294600010,Members of soil bacterial communities sensitive to tillage and crop rotation,SOIL BIOLOGY & BIOCHEMISTRY,12,42,2111-2118,DEC,2010,"Yin, Chuntao | Jones, Kenneth L. | Peterson, Dallas E. | Garrett, Karen A. | Hulbert, Scot H. | Paulitz, Timothy C.",Pyrosequencing | Tillage | Rotation | 16S rDNA | Acidobacteria | Gemmatimonadetes | Wheat | Soybean | Triticum aestivum | Glycine max,10.1016/j.soilbio.2010.08.006,NA,681EQ,0038-0717,NA,members of soil bacterial communities sensitive to tillage and crop rotation
tillage,WOS:A1991FK92500019,HYDROLOGICAL IMPACTS OF CHANGING LAND MANAGEMENT-PRACTICES IN A MODERATE-SIZED AGRICULTURAL CATCHMENT,WATER RESOURCES RESEARCH,5,27,845-855,MAY,1991,"POTTER, KW",,NA,NA,FK925,0043-1397,NA,hydrological impacts of changing land management-practices in a moderate-sized agricultural catchment
tillage,WOS:A1996UF74700017,"Tillage, planting date, and plant population effects on dryland corn",JOURNAL OF PRODUCTION AGRICULTURE,1,9,119-122,JAN-MAR,1996,"Norwood, CA | Currie, RS",,NA,NA,UF747,0890-8524,NA,"tillage, planting date, and plant population effects on dryland corn"
tillage,WOS:000072547900007,Deep and shallow banding of phosphorus and potassium as alternatives to broadcast fertilization for no-till corn,AGRONOMY JOURNAL,1,90,27-33,JAN-FEB,1998,"Bordoli, JM | Mallarino, AP",,NA,NA,ZC171,0002-1962,NA,deep and shallow banding of phosphorus and potassium as alternatives to broadcast fertilization for no-till corn
tillage,WOS:A1991GR48500016,WATER-USE EVALUATION OF WINTER COVER CROPS FOR NO-TILL SOYBEANS,JOURNAL OF SOIL AND WATER CONSERVATION,6,46,446-449,NOV-DEC,1991,"ZHU, JC | GANTZER, CJ | ANDERSON, SH | BEUSELINCK, PR | ALBERTS, EE",,NA,NA,GR485,0022-4561,NA,water-use evaluation of winter cover crops for no-till soybeans
tillage,WOS:000168989100016,"Small grain cover crops and wheel traffic effects on infiltration, runoff, and erosion",JOURNAL OF SOIL AND WATER CONSERVATION,2,56,160-164,NA,2001,"Kaspar, TC | Radke, JK | Laflen, JM",cover crops | erosion | infiltration | interrill | no-till | rainfall simulator | residue cover | rill | runoff | sedimen,NA,NA,437JT,0022-4561,NA,"small grain cover crops and wheel traffic effects on infiltration, runoff, and erosion"
tillage,WOS:000187438900010,Effects of tillage on along-row variability of wheat and maize biomass,PLANT PRODUCTION SCIENCE,4,6,295-301,DEC,2003,"Nakamoto, T | Yamagishi, J",minimum tillage | precision farming | semivariogram | spatial dependence,NA,NA,755YK,1343-943X,NA,effects of tillage on along-row variability of wheat and maize biomass
tillage,WOS:000181125600009,Cropping system effects on NO3-N loss with subsurface drainage water,TRANSACTIONS OF THE ASAE,6,45,1789-1797,NOV-DEC,2002,"Bakhsh, A | Kanwar, RS | Bailey, TB | Cambardella, CA | Karlen, DL | Colvin, TS",tillage | nitrogen management | nitrate leaching | water quality,NA,NA,648AE,0001-2351,NA,cropping system effects on no3-n loss with subsurface drainage water
tillage,WOS:A1991FL72100008,"DIURNAL ABUNDANCE AND SPATIAL-DISTRIBUTION OF ARMYWORM, (LEPIDOPTERA, NOCTUIDAE) IN NO-TILL CORN",JOURNAL OF ENTOMOLOGICAL SCIENCE,2,26,261-266,APR,1991,"LAUB, CA | LUNA, JM",INSECTA | PSEUDALETIA-UNIPUNCTA | FEEDING BEHAVIOR | SPATIAL ABUNDANCE | SAMPLING,NA,NA,FL721,0749-8004,NA,"diurnal abundance and spatial-distribution of armyworm, (lepidoptera, noctuidae) in no-till corn"
tillage,WOS:000271752700045,Timing of Broadcast Phosphorus Fertilization for No-Till Corn and Soybean,SOIL SCIENCE SOCIETY OF AMERICA JOURNAL,6,73,2143-2150,NOV-DEC,2009,"Mallarino, A. P. | Barcos, S. R. | Prater, J. R. | Wittry, D. J.",,10.2136/sssaj2008.0383,NA,519GJ,0361-5995,NA,timing of broadcast phosphorus fertilization for no-till corn and soybean
tillage,WOS:000303278500050,FACTOR ANALYSIS OF TILLAGE EFFECTS ON SOIL PROPERTIES OF GRANTSBURG SOILS IN SOUTHERN ILLINOIS UNDER CORN AND SOYBEAN,PAKISTAN JOURNAL OF BOTANY,2,44,795-800,APR,2012,"Hussain, Imtiaz | Olson, K. R.",,NA,NA,932GN,0556-3321,NA,factor analysis of tillage effects on soil properties of grantsburg soils in southern illinois under corn and soybean
tillage,WOS:000174171700165,Modeling and evaluation of alternative agricultural management practices in sand creek watershed,"SOIL EROSION RESEARCH FOR THE 21ST CENTURY, PROCEEDINGS",NA,NA,637-640,NA,2001,"Dalzell, BJ | Mulla, DJ | Gowda, PH",ADAPT | Minnesota | watershed modeling | conservation tillage | pasture,NA,NA,BT83J,NA,1-892769-16-6,modeling and evaluation of alternative agricultural management practices in sand creek watershed
tillage,WOS:000220382200022,Corn production as affected by nitrogen application timing and tillage,AGRONOMY JOURNAL,2,96,502-509,MAR-APR,2004,"Vetsch, JA | Randall, GW",,NA,NA,805RA,0002-1962,NA,corn production as affected by nitrogen application timing and tillage
tillage,WOS:000224037800024,Starter nitrogen fertilizer management for continuous no-till corn production,AGRONOMY JOURNAL,5,96,1412-1418,SEP-OCT,2004,"Niehues, BJ | Lamond, RE | Godsey, CB | Olsen, CJ",,NA,NA,856IB,0002-1962,NA,starter nitrogen fertilizer management for continuous no-till corn production
tillage,WOS:000282057500004,SUPPRESSION OF HETERODERA GLYCINES IN A SOYBEAN FIELD ARTIFICIALLY INFESTED WITH PASTEURIA NISHIZAWAE,NEMATROPICA,1,40,41-52,JUN,2010,"Noel, G. R. | Atibalentja, N. | Bauer, S. J.",Biological control | conservation tillage | genetic resistance | Heterodera glycines | no-tillage | Pasteuria nishizawae | soybean cyst nematode | suppressive soil,NA,NA,653BL,0099-5444,NA,suppression of heterodera glycines in a soybean field artificially infested with pasteuria nishizawae
tillage,WOS:000304725100023,Nitrous Oxide Emissions from Claypan Soils Due to Nitrogen Fertilizer Source and Tillage/Fertilizer Placement Practices,SOIL SCIENCE SOCIETY OF AMERICA JOURNAL,3,76,983-993,MAY-JUN,2012,"Nash, Patrick R. | Motavalli, Peter P. | Nelson, Kelly A.",,10.2136/sssaj2011.0296,NA,951MQ,0361-5995,NA,nitrous oxide emissions from claypan soils due to nitrogen fertilizer source and tillage/fertilizer placement practices
tillage,WOS:000382783300006,Soil Organic Carbon and Nitrogen Fractions under Different Land Uses and Tillage Practices,COMMUNICATIONS IN SOIL SCIENCE AND PLANT ANALYSIS,12,47,1528-1541,NA,2016,"Liu, Mengyun | Ussiri, David A. N. | Lal, Rattan",Land-uses | nitrogen fractions | organic carbon fractions | tillage practices,10.1080/00103624.2016.1194993,NA,DV2WQ,0010-3624,NA,soil organic carbon and nitrogen fractions under different land uses and tillage practices
tillage,WOS:000072681800007,An agronomic and economic comparison of the wheat-corn-fallow and wheat-sorghum-fallow rotations,JOURNAL OF PRODUCTION AGRICULTURE,1,11,67-73,JAN-MAR,1998,"Norwood, CA | Currie, RS",,NA,NA,ZD404,0890-8524,NA,an agronomic and economic comparison of the wheat-corn-fallow and wheat-sorghum-fallow rotations
tillage,WOS:A1997XE72100002,Rinsing practices of Australian farmers: The characteristics of farmers who do not rinse chemical residues from empty containers,JOURNAL OF ENVIRONMENTAL MANAGEMENT,2,50,129-146,JUN,1997,"Turrell, G | McGuffog, I",adoption | conservation innovation | rinsing | chemical containers | environment | public health | perceptions | mail survey | logistic regression | Australia,NA,NA,XE721,0301-4797,NA,rinsing practices of australian farmers: the characteristics of farmers who do not rinse chemical residues from empty containers
tillage,WOS:000254237700008,Influence of fall and early spring herbicide applications on winter and summer annual weed populations in no-till corn,WEED TECHNOLOGY,1,22,42-48,JAN-MAR,2008,"Monnig, Nicholas | Bradley, Kevin W.",fall herbicide applications | herbicide application timing | no-till | weed biomass | weed emergence | winter annuals,10.1614/WT-06-196.1,NA,277TN,0890-037X,NA,influence of fall and early spring herbicide applications on winter and summer annual weed populations in no-till corn
tillage,WOS:000076662500012,Starter fertilizer effects on grain sorghum hybrids grown on a soil high in residual phosphorus in a no-tillage environment,JOURNAL OF PLANT NUTRITION,11,21,2403-2415,NA,1998,"Gordon, WB | Whitney, DA | Fjell, DL",,NA,NA,132ZT,0190-4167,NA,starter fertilizer effects on grain sorghum hybrids grown on a soil high in residual phosphorus in a no-tillage environment
tillage,WOS:000169685300007,Reducing long-term atrazine runoff from South Central Nebraska,TRANSACTIONS OF THE ASAE,1,44,45-52,JAN-FEB,2001,"Gorneau, WS | Franti, TG | Benham, BL | Comfort, SD",best management practices | herbicide | tillage | atrazine | water quality,NA,NA,449LD,0001-2351,NA,reducing long-term atrazine runoff from south central nebraska
tillage,WOS:000236748200007,Determining soil quality indicators by factor analysis,SOIL & TILLAGE RESEARCH,2,87,194-204,JUN,2006,"Shukla, MK | Lal, R | Ebinger, M",soil bulk density | water stable aggregation | mean weight diameter | water infiltration | hydraulic conductivity | soil quality indicator | factor analysis | discriminant analysis,10.1016/j.still.2005.03.011,NA,032BF,0167-1987,NA,determining soil quality indicators by factor analysis
tillage,WOS:A1993LD97000010,NITRATE LEACHING UNDER IRRIGATED CORN,JOURNAL OF IRRIGATION AND DRAINAGE ENGINEERING,3,119,544-553,MAY-JUN,1993,"RITTER, WF | SCARBOROUGH, RW | CHIRNSIDE, AEM",,NA,NA,LD970,0733-9437,NA,nitrate leaching under irrigated corn
tillage,WOS:000395957900009,Is the use of no-till continuous or rotational? Quantifying tillage dynamics from time ordered spatially aggregated data,JOURNAL OF SOIL AND WATER CONSERVATION,2,72,131-138,MAR-APR,2017,"Kurkalova, Lyubov A. | Dat Quoc Tran",continuous no-till | corn soybean production | Iowa rotational no-till,10.2489/jswc.72.2.131,NA,EN4DL,0022-4561,NA,is the use of no-till continuous or rotational? quantifying tillage dynamics from time ordered spatially aggregated data
tillage,WOS:000172712200003,Evaluation of drainage and tillage effect on watertable depth and maize yield in wet inland valleys in southwestern Nigeria,AGRICULTURAL WATER MANAGEMENT,3,52,215-231,JAN 23,2002,"Ogban, PI | Babalola, O",soil water | air-filled porosity | inland valley bottoms,NA,NA,501XW,0378-3774,NA,evaluation of drainage and tillage effect on watertable depth and maize yield in wet inland valleys in southwestern nigeria
tillage,WOS:A1992HZ22900025,FERTILIZER MANAGEMENT EFFECT ON RECOVERY OF LABELED NITROGEN BY CONTINUOUS NO-TILL,AGRONOMY JOURNAL,3,84,490-496,MAY-JUN,1992,"TIMMONS, DR | BAKER, JL",,NA,NA,HZ229,0002-1962,NA,fertilizer management effect on recovery of labeled nitrogen by continuous no-till
tillage,WOS:000375157200036,Analysis of Best Management Practices Implementation on Water Quality Using the Soil and Water Assessment Tool,WATER,4,8,,APR,2016,"Motsinger, Jason | Kalita, Prasanta | Bhattarai, Rabin",best management practices | modeling | non-point source pollution | tile drainage | SWAT,10.3390/w8040145,NA,DK8DK,2073-4441,NA,analysis of best management practices implementation on water quality using the soil and water assessment tool
tillage,WOS:000370375200043,Tillage and Fertilizer Effects on Crop Yield and Soil Properties over 45 Years in Southern Illinois,AGRONOMY JOURNAL,1,108,415-426,JAN-FEB,2016,"Cook, Rachel L. | Trlica, Andrew",,10.2134/agronj2015.0397,NA,DE1GN,0002-1962,NA,tillage and fertilizer effects on crop yield and soil properties over 45 years in southern illinois
tillage,WOS:000264677100006,Runoff and dissolved organic carbon loss from a paired-watershed study of three adjacent agricultural Watersheds,AGRICULTURE ECOSYSTEMS & ENVIRONMENT,3-4,130,115-122,APR,2009,"Veum, Kristen S. | Goyne, Keith W. | Motavalli, Peter P. | Udawatta, Ranjith P.",Agroforestry buffers | Dissolved organic carbon | Grass buffers | Paired-watershed | Runoff | Agroecosystem,10.1016/j.agee.2008.12.006,NA,425ZN,0167-8809,NA,runoff and dissolved organic carbon loss from a paired-watershed study of three adjacent agricultural watersheds
tillage,WOS:000085908900018,Effects of 30 years of cropping and tillage systems on surface soil test changes,COMMUNICATIONS IN SOIL SCIENCE AND PLANT ANALYSIS,1-2,31,241-257,NA,2000,"Thompson, CA | Whitney, DA",,NA,NA,294JV,0010-3624,NA,effects of 30 years of cropping and tillage systems on surface soil test changes
tillage,WOS:A1993LC31400034,28 YEARS OF TILLAGE EFFECTS ON 2 SOILS IN OHIO,SOIL SCIENCE SOCIETY OF AMERICA JOURNAL,2,57,506-512,MAR-APR,1993,"MAHBOUBI, AA | LAL, R | FAUSSEY, NR",,NA,NA,LC314,0361-5995,NA,28 years of tillage effects on 2 soils in ohio
tillage,WOS:000336821200004,Ecosystem services along a management gradient in Michigan (USA) cropping systems,AGRICULTURE ECOSYSTEMS & ENVIRONMENT,NA,189,28-35,MAY 1,2014,"Syswerda, S. P. | Robertson, G. P.",Ecosystem service | Climate change | Nitrate leaching | Organic agriculture | No-till | Diversity,10.1016/j.agee.2014.03.006,NA,AI4FN,0167-8809,NA,ecosystem services along a management gradient in michigan (usa) cropping systems
tillage,WOS:000233017900003,Soil carbon and nitrogen changes as affected by tillage system and crop biomass in a corn-soybean rotation,APPLIED SOIL ECOLOGY,3,30,174-191,NOV,2005,"Al-Kaisi, MM | Yin, XH | Licht, MA",carbon input | corn | soil organic carbon | soil organic nitrogen | soybean | tillage | yield,10.1016/j.apsoil.2005.02.014,NA,980KR,0929-1393,NA,soil carbon and nitrogen changes as affected by tillage system and crop biomass in a corn-soybean rotation
