review,uid,title,journal,issue,volume,pages,date,year,authors,keywords,doi,article_no,isi_id,issn,isbn,title_lower
tillage,WOS:000386463000021,Impacts of Corn Residue Grazing and Baling on Wind Erosion Potential in a Semiarid Environment,SOIL SCIENCE SOCIETY OF AMERICA JOURNAL,4,80,1027-1037,JUL-AUG,2016,"Blanco-Canqui, Humberto | Tatarko, John | Stalker, Aaron L. | Shaver, Tim M. | van Donk, Simon J.",,10.2136/sssaj2016.03.0073,NA,EA2YJ,0361-5995,NA,impacts of corn residue grazing and baling on wind erosion potential in a semiarid environment
tillage,WOS:000322052600003,Suitability of cover crop monocultures for late-season forage in South Dakota,CANADIAN JOURNAL OF PLANT SCIENCE,4,93,589-597,JUL,2013,"Hansen, Matthew J. | Owens, Vance N. | Beck, Dwayne | Sexton, Peter",Forage quality | forage yield | cover crops | legumes | grasses,10.4141/CJPS2012-094,NA,186NZ,0008-4220,NA,suitability of cover crop monocultures for late-season forage in south dakota
tillage,WOS:000277591600006,Identification of Nitrogen Management Categories by Corn Stalk Nitrate Sampling Guided by Aerial Imagery,AGRONOMY JOURNAL,3,102,858-867,MAY-JUN,2010,"Kyveryga, P. M. | Tao, H. | Morris, T. F. | Blackmer, T. M.",,10.2134/agronj2009.0401,NA,595DT,0002-1962,NA,identification of nitrogen management categories by corn stalk nitrate sampling guided by aerial imagery
tillage,WOS:000356987600017,Soybean yield gaps and water productivity in the western US Corn Belt,FIELD CROPS RESEARCH,NA,179,150-163,AUG 1,2015,"Grassini, Patricio | Torrion, Jessica A. | Yang, Haishun S. | Rees, Jennifer | Andersen, Daryl | Cassman, Kenneth G. | Specht, James E.",Soybean | Glycine max L. | On-farm data | Yield potential | Yield gap | Water productivity,10.1016/j.fcr.2015.04.015,NA,CL5GK,0378-4290,NA,soybean yield gaps and water productivity in the western us corn belt
tillage,WOS:000351640800031,"Potassium Uptake by Corn and Soybean, Recycling to Soil, and Impact on Soil Test Potassium",SOIL SCIENCE SOCIETY OF AMERICA JOURNAL,1,79,314-327,JAN-FEB,2015,"Oltmans, Ryan R. | Mallarino, Antonio P.",,10.2136/sssaj2014.07.0272,NA,CE2JB,0361-5995,NA,"potassium uptake by corn and soybean, recycling to soil, and impact on soil test potassium"
tillage,WOS:A1995QW85500018,SIMULATING NO3-N TRANSPORT TO SUBSURFACE DRAIN FLOWS AS AFFECTED BY TILLAGE UNDER CONTINUOUS CORN USING MODIFIED RZWQM,TRANSACTIONS OF THE ASAE,2,38,499-506,MAR-APR,1995,"SINGH, P | KANWAR, RS",WATER QUALITY | HYDROLOGIC MODELING | SOLUTE TRANSPORT,NA,NA,QW855,0001-2351,NA,simulating no3-n transport to subsurface drain flows as affected by tillage under continuous corn using modified rzwqm
tillage,WOS:000304005000003,"Integrated crops and livestock in central North Dakota, USA: Agroecosystem management to buffer soil change",RENEWABLE AGRICULTURE AND FOOD SYSTEMS,2,27,115-124,JUN,2012,"Liebig, M. A. | Tanaka, D. L. | Kronberg, S. L. | Scholljegerdes, E. J. | Karn, J. F.",integrated agricultural systems | soil change | soil quality,10.1017/S1742170511000172,NA,941YH,1742-1705,NA,"integrated crops and livestock in central north dakota, usa: agroecosystem management to buffer soil change"
tillage,WOS:A1997XH51800003,Long-term tillage effects on runoff and soil erosion under simulated rainfall for a central Ohio soil,SOIL & TILLAGE RESEARCH,3,42,175-184,JUN,1997,"Choudhary, MA | Lal, R | Dick, WA",tillage | non-point source pollution | soil erodibility | runoff | soil splash | water quality,NA,NA,XH518,0167-1987,NA,long-term tillage effects on runoff and soil erosion under simulated rainfall for a central ohio soil
tillage,WOS:000257019300014,Does long-term center-pivot irrigation increase soil carbon stocks in semi-arid agro-ecosystems?,GEODERMA,1-2,145,121-129,MAY 15,2008,"Denef, K. | Stewart, C. E. | Brenner, J. | Paustian, K.",soil organic carbon | soil inorganic carbon | center-pivot irrigation | depth,10.1016/j.geoderma.2008.03.002,NA,317KO,0016-7061,NA,does long-term center-pivot irrigation increase soil carbon stocks in semi-arid agro-ecosystems?
tillage,WOS:000315659400100,Double-cropping with winter camelina in the northern Corn Belt to produce fuel and food,INDUSTRIAL CROPS AND PRODUCTS,NA,44,718-725,JAN,2013,"Gesch, R. W. | Archer, D. W.",Camelina | Double-cropping | Biofuel | Oil yield | Food versus fuel,10.1016/j.indcrop.2012.05.023,NA,099XO,0926-6690,NA,double-cropping with winter camelina in the northern corn belt to produce fuel and food
tillage,WOS:000333459900123,Effects of Straw Incorporation on Soil Organic Matter and Soil Water-Stable Aggregates Content in Semiarid Regions of Northwest China,PLOS ONE,3,9,,MAR 24,2014,"Zhang, Peng | Wei, Ting | Jia, Zhikuan | Han, Qingfang | Ren, Xiaolong | Li, Yongping",,10.1371/journal.pone.0092839,NA,AD7QO,1932-6203,NA,effects of straw incorporation on soil organic matter and soil water-stable aggregates content in semiarid regions of northwest china
tillage,WOS:000248103200030,Soil profile nitrate response to nitrogen fertilization of winter triticale,SOIL SCIENCE SOCIETY OF AMERICA JOURNAL,4,71,1343-1351,JUL-AUG,2007,"Nance, Carasella D. | Gibson, Lance R.",,10.2136/sssaj2006.0262,NA,191AW,0361-5995,NA,soil profile nitrate response to nitrogen fertilization of winter triticale
tillage,WOS:000380761200004,Relationships Between Soil Carbon and Soil Texture in the Northern Great Plains,SOIL SCIENCE,8,181,386-392,AUG,2016,"Augustin, Christopher | Cihacek, Larry J.",soil texture | soil organic matter | soil carbon sequestration | soil bulk density | soil C,10.1097/SS.0000000000000173,NA,DS4OU,0038-075X,NA,relationships between soil carbon and soil texture in the northern great plains
tillage,WOS:000347339900027,Soil Carbon Accumulation under Switchgrass Barriers,AGRONOMY JOURNAL,6,106,2185-2192,NOV-DEC,2014,"Blanco-Canqui, Humberto | Gilley, John E. | Eisenhauer, Dean E. | Jasa, Paul J. | Boldt, Alan",,10.2134/agronj14.0227,NA,AY1FT,0002-1962,NA,soil carbon accumulation under switchgrass barriers
tillage,WOS:000328628400025,Intra-Aggregate Pore Structures and Escherichia coli Distribution by Water Flow within and Movement Out of Soil Macroaggregates,VADOSE ZONE JOURNAL,4,12,,NOV,2013,"Wang, W. | Kravchenko, A. N. | Johnson, T. | Srinivasan, S. | Ananyeva, K. A. | Smucker, A. J. M. | Rose, J. B. | Rivers, M. L.",,10.2136/vzj2013.01.0012,NA,274TF,1539-1663,NA,intra-aggregate pore structures and escherichia coli distribution by water flow within and movement out of soil macroaggregates
tillage,WOS:000407749100005,Root-derived nitrous oxide emissions from an Upper Midwest agricultural ecosystem,NUTRIENT CYCLING IN AGROECOSYSTEMS,1,109,57-75,SEP,2017,"Van Vleck, Harriet E. | King, Jennifer Y. | Allan, Deborah L. | Fabrizzi, Karina P.",Nitrous oxide | Stable isotope tracers | Root residue | Emission factor,10.1007/s10705-017-9869-3,NA,FD8BB,1385-1314,NA,root-derived nitrous oxide emissions from an upper midwest agricultural ecosystem
tillage,WOS:000347589500074,Characterizing phosphorus dynamics in tile-drained agricultural fields of eastern Wisconsin,JOURNAL OF HYDROLOGY,NA,519,892-901,NOV 27,2014,"Madison, Allison M. | Ruark, Matthew D. | Stuntebeck, Todd D. | Komiskey, Matthew J. | Good, Lara W. | Drummy, Nancy | Cooley, Eric T.",Phosphorus | Tile drainage | Manure,10.1016/j.jhydrol.2014.08.016,NA,AY5BY,0022-1694,NA,characterizing phosphorus dynamics in tile-drained agricultural fields of eastern wisconsin
tillage,WOS:000355325000016,Consultant's Perspective on the Evolution and Management of Glyphosate-Resistant Kochia (Kochia scoparia) in Western Kansas,WEED TECHNOLOGY,2,29,318-328,APR-JUN,2015,"Godar, Amar S. | Stahlman, Phillip W.",Crop consultants | fallow | glyphosate rate | glyphosate resistance | herbicide resistance | herbicide-resistant crops | survey,10.1614/WT-D-14-00043.1,NA,CJ2OT,0890-037X,NA,consultant's perspective on the evolution and management of glyphosate-resistant kochia (kochia scoparia) in western kansas
tillage,WOS:A1995RF64100003,ENDOPOLYPLOIDIZATION OF MESOCOTYLS IN NEBRASKA MAIZE POPULATIONS SELECTED FOR COLD TOLERANCE,CROP SCIENCE,4,35,958-961,JUL-AUG,1995,"WILHELM, E | BIRADAR, DP | BULLOCK, DG | RAYBURN, AL",,NA,NA,RF641,0011-183X,NA,endopolyploidization of mesocotyls in nebraska maize populations selected for cold tolerance
tillage,WOS:000246567400025,Producer-researcher interactions in on-farm research: A case study on developing a certified organic research site,AGRONOMY JOURNAL,3,99,779-790,MAY-JUN,2007,"Karlen, Douglas L. | Cambardella, Cynthia A. | Bull, Carolee T. | Chase, Craig A. | Gibson, Lance R. | Delate, Kathleen",,10.2134/agronj2006.0125,NA,169BJ,0002-1962,NA,producer-researcher interactions in on-farm research: a case study on developing a certified organic research site
tillage,WOS:000287574000012,Dairy Slurry Application Method Impacts Ammonia Emission and Nitrate Leaching in No-Till Corn Silage,JOURNAL OF ENVIRONMENTAL QUALITY,2,40,383-392,MAR,2011,"Powell, J. M. | Jokela, W. E. | Misselbrook, T. H.",,10.2134/jeq2010.0082,NA,724KE,0047-2425,NA,dairy slurry application method impacts ammonia emission and nitrate leaching in no-till corn silage
tillage,WOS:A1993LQ16200006,TILLAGE EFFECTS ON SELECTED PHYSICAL-PROPERTIES OF GRANTSBURG SILT LOAM,COMMUNICATIONS IN SOIL SCIENCE AND PLANT ANALYSIS,13-14,24,1509-1527,NA,1993,"KITUR, BK | OLSON, KR | SIEMENS, JC | PHILLIPS, SR",,NA,NA,LQ162,0010-3624,NA,tillage effects on selected physical-properties of grantsburg silt loam
tillage,WOS:000297277200004,Modeling gross primary production of irrigated and rain-fed maize using MODIS imagery and CO2 flux tower data,AGRICULTURAL AND FOREST METEOROLOGY,12,151,1514-1528,DEC 15,2011,"Kalfas, Joshua L. | Xiao, Xiangming | Vanegas, Diana X. | Verma, Shashi B. | Suyker, Andrew E.","Production efficiency model, Vegetation | Photosynthesis Model (VPM), Carbon | fluxes, C4 photosynthesis, Corn",10.1016/j.agrformet.2011.06.007,NA,851NG,0168-1923,NA,modeling gross primary production of irrigated and rain-fed maize using modis imagery and co2 flux tower data
tillage,WOS:A1992LD80400002,"HERBICIDE AND NITRATE VARIATION IN ALLUVIUM UNDERLYING A CORN FIELD AT A SITE IN IOWA COUNTY, IOWA",WATER RESOURCES BULLETIN,6,28,1001-1011,NOV-DEC,1992,"KALKHOFF, SJ | DETROY, MG | CHERRYHOLMES, KL | KUZNIAR, RL",NONPOINT SOURCE POLLUTION | INFILTRATION | NUTRIENTS | HERBICIDES | ALLUVIAL AQUIFER,NA,NA,LD804,0043-1370,NA,"herbicide and nitrate variation in alluvium underlying a corn field at a site in iowa county, iowa"
tillage,WOS:000397407100006,An integrated approach to control glyphosate-resistant Ambrosia trifida with tillage and herbicides in glyphosate-resistant maize,WEED RESEARCH,2,57,112-122,APR,2017,"Ganie, Z. A. | Lindquist, J. L. | Jugulam, M. | Kruger, G. R. | Marx, D. B. | Jhala, A. J.",giant ragweed | competition | maize yield | late-season escapes | weed resistance management,10.1111/wre.12244,NA,EP5GN,0043-1737,NA,an integrated approach to control glyphosate-resistant ambrosia trifida with tillage and herbicides in glyphosate-resistant maize
tillage,WOS:000255619200008,Interannual water vapor and energy exchange in an irrigated maize-based agroecosystem,AGRICULTURAL AND FOREST METEOROLOGY,3,148,417-427,MAR 13,2008,"Suyker, Andrew E. | Verma, Shashi B.",evapotranspiration | energy exchange | maize | soybean | canopy conductance,10.1016/j.agrformet.2007.10.005,NA,297LW,0168-1923,NA,interannual water vapor and energy exchange in an irrigated maize-based agroecosystem
tillage,WOS:000361048300018,Soil Response to Corn Residue Removal and Cover Crops in Eastern South Dakota,SOIL SCIENCE SOCIETY OF AMERICA JOURNAL,4,79,1179-1187,JUL-AUG,2015,"Wegner, Brianna R. | Kumar, Sandeep | Osborne, Shannon L. | Schumacher, Thomas E. | Vahyala, Ibrahim E. | Eynard, Anna",,10.2136/sssaj2014.10.0399,NA,CR0XZ,0361-5995,NA,soil response to corn residue removal and cover crops in eastern south dakota
tillage,WOS:000290212000027,Categorical Analysis of Spatial Variability in Economic Yield Response of Corn to Nitrogen Fertilization,AGRONOMY JOURNAL,3,103,796-804,MAY-JUN,2011,"Kyveryga, P. M. | Blackmer, T. M. | Caragea, P. C.",,10.2134/agronj2010.0411,NA,759AN,0002-1962,NA,categorical analysis of spatial variability in economic yield response of corn to nitrogen fertilization
tillage,WOS:000084993900021,Site-specific factors affecting corn response to starter fertilizer,JOURNAL OF PRODUCTION AGRICULTURE,4,12,664-670,OCT-DEC,1999,"Bundy, LG | Andraski, TW",,NA,NA,278MQ,0890-8524,NA,site-specific factors affecting corn response to starter fertilizer
tillage,WOS:000233147100055,Biomass production of switchgrass in central South Dakota,CROP SCIENCE,6,45,2583-2590,NOV-DEC,2005,"Lee, DK | Boe, A",,NA,NA,982GW,0011-183X,NA,biomass production of switchgrass in central south dakota
tillage,WOS:000351640800025,"Short-Term Stover, Tillage, and Nitrogen Management Affect Near-Surface Soil Organic Matter",SOIL SCIENCE SOCIETY OF AMERICA JOURNAL,1,79,251-260,JAN-FEB,2015,"Sindelar, Aaron J. | Lamb, John A. | Coulter, Jeffrey A.",,10.2136/sssaj2014.08.0337,NA,CE2JB,0361-5995,NA,"short-term stover, tillage, and nitrogen management affect near-surface soil organic matter"
tillage,WOS:000380953000007,Agroecological approaches to mitigate increasing limitation of corn yields by water availability,AGRICULTURE AND CLIMATE CHANGE - ADAPTING CROPS TO INCREASED UNCERTAINTY (AGRI 2015),NA,29,11-12,NA,2015,"Gaudin, Amelie C. M. | Tolhurst, Tor | Ker, Alan | Martin, Ralph | Deen, Willima",,10.1016/j.proenv.2015.07.129,NA,BF4HW,1878-0296,NA,agroecological approaches to mitigate increasing limitation of corn yields by water availability
tillage,WOS:000083880600005,Soil compaction and tillage effects on soil physical properties of a mollic ochraqualf in northwest Ohio,JOURNAL OF SUSTAINABLE AGRICULTURE,4,14,53-65,NA,1999,"Lal, R",cereal | grains | intercropping | Nigeria | oil palm (Elaeis guineensis Jacq) | sex-ratio | soil pH | soil nutrients | sustainable agriculture,NA,NA,259EB,1044-0046,NA,soil compaction and tillage effects on soil physical properties of a mollic ochraqualf in northwest ohio
tillage,WOS:000287679500019,Number of Solaria Needed to Predict Weed Seedlings in Two Summer Crops,WEED TECHNOLOGY,1,25,113-118,JAN-MAR,2011,"Eyherabide, Juan J. | Cendoya, Maria G. | Forcella, Frank | Irazazabal, Marisol",Bioeconomic models | site-specific weed management | weed control | weed seedling prediction | weed | thresholds,10.1614/WT-D-10-00071.1,NA,725XF,0890-037X,NA,number of solaria needed to predict weed seedlings in two summer crops
tillage,WOS:000248022500005,Soil water depletion and recharge under ten crop species and applications to the principles of dynamic cropping systems,AGRONOMY JOURNAL,4,99,931-938,JUL-AUG,2007,"Merrill, Stephen D. | Tanaka, Donald L. | Krupinsky, Joseph M. | Liebig, Mark A. | Hanson, Jonathan D.",,10.2134/agronj2006.0134,NA,189XS,0002-1962,NA,soil water depletion and recharge under ten crop species and applications to the principles of dynamic cropping systems
tillage,WOS:000246567400030,Impacts of variable-rate phosphorus fertilization based on dense grid soil sampling on soil-test phosphorus and grain yield of corn and soybean,AGRONOMY JOURNAL,3,99,822-832,MAY-JUN,2007,"Bermudez, Manuel | Mallarino, Antonio P.",,10.2134/agronj2006.0172,NA,169BJ,0002-1962,NA,impacts of variable-rate phosphorus fertilization based on dense grid soil sampling on soil-test phosphorus and grain yield of corn and soybean
tillage,WOS:000383316400005,Regional climatological probabilities to increase success and reduce risk in rain-fed cover crop management,JOURNAL OF SOIL AND WATER CONSERVATION,5,71,377-384,SEP-OCT,2016,"Svoma, B. M. | Gantzer, C. J.",cover crops | evapotranspiration | soil health | soil water | termination date,10.2489/jswc.71.5.377,NA,DW0FN,0022-4561,NA,regional climatological probabilities to increase success and reduce risk in rain-fed cover crop management
tillage,WOS:000259414000032,"Variability of soil properties, early phosphorus and potassium uptake, and incidence of pests and weeds in relation to soybean grain yield",AGRONOMY JOURNAL,5,100,1450-1462,SEP-OCT,2008,"Sawchik, Jorge | Mallarino, Antonio P.",,10.2134/agronj2007.0303,NA,351GZ,0002-1962,NA,"variability of soil properties, early phosphorus and potassium uptake, and incidence of pests and weeds in relation to soybean grain yield"
tillage,WOS:000081646800004,Evaluation of the root zone water quality model using field-measured data from the Missouri MSEA,AGRONOMY JOURNAL,2,91,183-192,MAR-APR,1999,"Ghidey, F | Alberts, EE | Kitchen, NR",,NA,NA,220CK,0002-1962,NA,evaluation of the root zone water quality model using field-measured data from the missouri msea
tillage,WOS:000412605600058,Effect of Nitrogen Fertilizer Application on Corn Residue Decomposition in Iowa,AGRONOMY JOURNAL,5,109,2415-2427,SEP-OCT,2017,"Al-Kaisi, Mahdi M. | Kwaw-Mensah, David | Ci, En",,10.2134/agronj2016.11.0633,NA,FJ3BR,0002-1962,NA,effect of nitrogen fertilizer application on corn residue decomposition in iowa
tillage,WOS:000182540300005,Forage yield and economic losses associated with the brown-midrib trait in sudangrass,CROP SCIENCE,3,43,782-789,MAY-JUN,2003,"Casler, MD | Pedersen, JF | Undersander, DJ",,NA,NA,672UB,0011-183X,NA,forage yield and economic losses associated with the brown-midrib trait in sudangrass
tillage,WOS:000221525400070,Soybean production in the midwestern USA: technologies for sustainable and stable yields,"VII WORLD SOYBEAN RESEARCH CONFERENCE - VI INTERNATIONAL SOYBEAN PROCESSING AND UTILIZATION CONFERENCE - III CONGRESSO BRASILEIRO DE SOJA, PROCEEDINGS",NA,NA,523-530,NA,2004,"Nafziger, ED",,NA,NA,BAC40,NA,85-7033-004-9,soybean production in the midwestern usa: technologies for sustainable and stable yields
tillage,WOS:000412605600025,"Sorghum-Sudangrass Responses to Nitrogen and Tillage following Polyphenol-Containing Legumes, Alfalfa, Reed Canarygrass, and Kale",AGRONOMY JOURNAL,5,109,2050-2062,SEP-OCT,2017,"Grabber, John H. | Yost, Matt A. | Coulter, Jeffrey A. | Sullivan, Michael L.",,10.2134/agronj2016.09.0550,NA,FJ3BR,0002-1962,NA,"sorghum-sudangrass responses to nitrogen and tillage following polyphenol-containing legumes, alfalfa, reed canarygrass, and kale"
tillage,WOS:000185303200022,Management and soil-quality effects on fertilizer-use efficiency and leaching,SOIL SCIENCE SOCIETY OF AMERICA JOURNAL,5,67,1524-1532,SEP-OCT,2003,"Nissen, TM | Wander, MM",,NA,NA,721EC,0361-5995,NA,management and soil-quality effects on fertilizer-use efficiency and leaching
tillage,WOS:000318537300004,Corn Performance under Managed Drought Stress and in a Kura Clover Living Mulch Intercropping System,AGRONOMY JOURNAL,3,105,579-586,MAY-JUN,2013,"Ziyomo, Cathrine | Albrecht, Kenneth A. | Baker, John M. | Bernardo, Rex",,10.2134/agronj2012.0427,NA,138VE,0002-1962,NA,corn performance under managed drought stress and in a kura clover living mulch intercropping system
tillage,WOS:A1990ER67100032,DETERMINATION OF AN OPTIMAL CROPPING SYSTEM FOR EROSIVE SOIL,JOURNAL OF PRODUCTION AGRICULTURE,4,3,591-596,OCT-DEC,1990,"SMITH, EG | HALLAM, A",,NA,NA,ER671,0890-8524,NA,determination of an optimal cropping system for erosive soil
tillage,WOS:000317335400015,Cover Crop Mulch and Weed Management Influence Arthropod Communities in Strip-Tilled Cabbage,ENVIRONMENTAL ENTOMOLOGY,2,42,293-306,APR,2013,"Bryant, Alexandria | Brainard, Daniel C. | Haramoto, Erin R. | Szendrei, Zsofia",habitat management | herbicide | oat | herbivore | predator,10.1603/EN12192,NA,122RL,0046-225X,NA,cover crop mulch and weed management influence arthropod communities in strip-tilled cabbage
tillage,WOS:000236009100008,Soil organic nitrogen enrichment following soybean in an Iowa corn-soybean rotation,SOIL SCIENCE SOCIETY OF AMERICA JOURNAL,2,70,382-392,MAR-APR,2006,"Martens, DA | Jaynes, DB | Colvin, TS | Kaspar, TC | Karlen, DL",,10.2136/sssaj2005.0112,NA,021TQ,0361-5995,NA,soil organic nitrogen enrichment following soybean in an iowa corn-soybean rotation
tillage,WOS:000283897200015,Perennial Filter Strips Reduce Nitrate Levels in Soil and Shallow Groundwater after Grassland-to-Cropland Conversion,JOURNAL OF ENVIRONMENTAL QUALITY,6,39,2006-2015,NOV-DEC,2010,"Zhou, Xiaobo | Helmers, Matthew J. | Asbjornsen, Heidi | Kolka, Randy | Tomer, Mark D.",,10.2134/jeq2010.0151,NA,676FU,0047-2425,NA,perennial filter strips reduce nitrate levels in soil and shallow groundwater after grassland-to-cropland conversion
tillage,WOS:000384562700012,Water infiltration and soil water content in claypan soils influenced by agroforestry and grass buffers compared to row crop management,AGROFORESTRY SYSTEMS,5,90,839-860,OCT,2016,"Sahin, Handan | Anderson, S. H. | Udawatta, R. P.",Infiltration rate | Saturated hydraulic conductivity | Sorptivity,10.1007/s10457-016-9899-x,NA,DX7JK,0167-4366,NA,water infiltration and soil water content in claypan soils influenced by agroforestry and grass buffers compared to row crop management
tillage,WOS:000360770400034,"Nitrogen and Tillage Management Affect Corn Cellulosic Yield, Composition, and Ethanol Potential",BIOENERGY RESEARCH,3,8,1284-1291,SEP,2015,"Sindelar, Aaron J. | Lamb, John A. | Coulter, Jeffrey A. | Sheaffer, Craig C. | Vetsch, Jeffrey A.",Cellulosic ethanol | Corn | Nitrogen | Stover | Tillage,10.1007/s12155-015-9586-1,NA,CQ7GG,1939-1234,NA,"nitrogen and tillage management affect corn cellulosic yield, composition, and ethanol potential"
tillage,WOS:000175780900007,The use of winter annual legume cover crops in a wheat-grain sorghum rotation in south central Kansas,JOURNAL OF SUSTAINABLE AGRICULTURE,2,20,69-88,NA,2002,"Janke, RR | Claassen, MM | Heer, WF | Jost, J | Freyenberger, S | Norman, D",legume cover crops | hairy vetch | Austrian winter pea | on-farm research | nitrogen,NA,NA,555EM,1044-0046,NA,the use of winter annual legume cover crops in a wheat-grain sorghum rotation in south central kansas
tillage,WOS:A1992JH14000010,FORAGE-LEGUME SMALL-GRAIN INTERCROPS - NITROGEN-PRODUCTION AND RESPONSE OF SUBSEQUENT CORN,JOURNAL OF PRODUCTION AGRICULTURE,3,5,340-348,JUL-SEP,1992,"HESTERMAN, OB | GRIFFIN, TS | WILLIAMS, PT | HARRIS, GH | CHRISTENSON, DR",,NA,NA,JH140,0890-8524,NA,forage-legume small-grain intercrops - nitrogen-production and response of subsequent corn
tillage,WOS:000258367600011,Assessment of nitrogen losses to the environment with a Nitrogen Trading Tool (NTT),COMPUTERS AND ELECTRONICS IN AGRICULTURE,2,63,193-206,OCT,2008,"Delgado, J. A. | Shaffer, M. J. | Lal, H. | McKinney, S. P. | Gross, C. M. | Cover, H.",Nitrate Leaching | nitrogen credits | Nitrogen Trading Tool | NLEAP | NTT | N2O | global warming potential | carbon sequestration equivalents,10.1016/j.compag.2008.02.009,NA,336MI,0168-1699,NA,assessment of nitrogen losses to the environment with a nitrogen trading tool (ntt)
tillage,WOS:000334361000002,Effects of straw carbon input on carbon dynamics in agricultural soils: a meta-analysis,GLOBAL CHANGE BIOLOGY,5,20,1366-1381,MAY,2014,"Liu, Chang | Lu, Meng | Cui, Jun | Li, Bo | Fang, Changming",GHGs emission | soil organic carbon | straw return | carbon sequestration | meta-analysis,10.1111/gcb.12517,NA,AE9WB,1354-1013,NA,effects of straw carbon input on carbon dynamics in agricultural soils: a meta-analysis
tillage,WOS:000182297900002,Effects of management practices on annual net N-mineralization in a restored prairie and maize agroecosystems,BIOGEOCHEMISTRY,2,63,135-160,APR-MAY,2003,"Brye, KR | Norman, JM | Gower, ST | Bundy, LG",agroecosystems | carbon | mineralization | nitrogen | restored prairie | Wisconsin,NA,NA,668MN,0168-2563,NA,effects of management practices on annual net n-mineralization in a restored prairie and maize agroecosystems
tillage,WOS:000184217600008,Developing weed-suppressive soils through improved soil quality management,SOIL & TILLAGE RESEARCH,2,72,193-202,AUG,2003,"Kremer, RJ | Li, JM",conservation biological control | organic matter | soil enzyme activity | Sustainability | weed-suppressive bacteria | water-stable aggregates,10.1016/S0167-1987(03)00088-6,NA,702HC,0167-1987,NA,developing weed-suppressive soils through improved soil quality management
tillage,WOS:000228037700030,Use of a rye cover crop following corn in rotation with soybean in the upper Midwest,AGRONOMY JOURNAL,2,97,587-598,MAR-APR,2005,"De Bruin, JL | Porter, PM | Jordan, NR",,NA,NA,911WP,0002-1962,NA,use of a rye cover crop following corn in rotation with soybean in the upper midwest
tillage,WOS:000084831700044,Occupancy and geometrical properties of Lumbricus terrestris L-burrows affecting infiltration,PEDOBIOLOGIA,6,43,782-794,DEC,1999,"Shipitalo, MJ | Butt, KR",burrow morphology | earthworms | macropores | preferential flow,NA,NA,275QW,0031-4056,NA,occupancy and geometrical properties of lumbricus terrestris l-burrows affecting infiltration
tillage,WOS:000285235100008,"Variability of soil physical quality in uneroded, eroded, and depositional cropland sites",GEOMORPHOLOGY,1,125,85-91,JAN 1,2011,"Stavi, I. | Lal, R.",Carbon cycle | Conservation agriculture | Geomorphic processes | Landscape functionality | Soil erodibility | Soil structure,10.1016/j.geomorph.2010.09.006,NA,693PD,0169-555X,NA,"variability of soil physical quality in uneroded, eroded, and depositional cropland sites"
tillage,WOS:000181580000011,Carbon sequestration and agricultural greenhouse gas emissions in Canada based on CEEMA analyses,CHANGING PRAIRIE LANDSCAPES,NA,32,159-+,NA,2000,"Boehm, MM | Kulshreshtha, S | Desjardins, RL | Junkins, B",,NA,NA,BW32M,0317-6401,0-88977-146-4,carbon sequestration and agricultural greenhouse gas emissions in canada based on ceema analyses
