review,uid,title,journal,issue,volume,pages,date,year,authors,keywords,doi,article_no,isi_id,issn,isbn,title_lower
nutrient,WOS:000496024200006,Competition for N-15-labeled nitrogen in a jujube tree (Zizyphus jujuba Mill.)/wheat (Triticum aestivum L.) agroforestry system in northwestern China,AGROFORESTRY SYSTEMS,6,93,2097-2110,DEC,2019,"Zhang, W. | Xu, W. L. | Ahanbieke, P. | Wang, B. J. | Hao, X. D. | Zhu, Y. | Li, L. H.",N derived from fertilizer | Fertilizer-use efficiency | Nitrogen acquisition | LER,10.1007/s10457-018-0332-5,NA,JM2AW,0167-4366,NA,competition for n-15-labeled nitrogen in a jujube tree (zizyphus jujuba mill.)/wheat (triticum aestivum l.) agroforestry system in northwestern china
nutrient,WOS:000495575600007,Soil physicochemical properties influenced by nitrogen sources and rates in the central Great Plains,JOURNAL OF SOIL AND WATER CONSERVATION,6,74,584-593,NOV-DEC,2019,"Mikha, M. M. | Obour, A. K. | Kumar, V | Stahlman, P. W.",nitrogen fertilizer sources and rates | nutrient management | soil science | tillage,10.2489/jswc.74.6.584,NA,JL5MU,0022-4561,NA,soil physicochemical properties influenced by nitrogen sources and rates in the central great plains
nutrient,WOS:000462209300011,Farm adoption of embodied knowledge and information intensive precision agriculture technology bundles,PRECISION AGRICULTURE,2,20,348-361,APR,2019,"Miller, N. J. | Griffin, T. W. | Ciampitti, I. A. | Sharda, A.",Automated guidance | Automated section control | Lightbar | Variable rate | Markov | Transition probability,10.1007/s11119-018-9611-4,NA,HQ2DH,1385-2256,NA,farm adoption of embodied knowledge and information intensive precision agriculture technology bundles
nutrient,WOS:000468592900017,Contrasting NO3-N concentration patterns at two karst springs in Iowa (USA): insights on aquifer nitrogen storage and delivery,HYDROGEOLOGY JOURNAL,4,27,1389-1400,JUN,2019,"Schilling, Keith E. | Jones, Christopher S. | Clark, Ryan J. | Libra, Robert D. | Liang, Xiuyu | Zhang, You-Kuan",Nitrate | Karst | Agriculture | USA,10.1007/s10040-019-01935-y,NA,HZ1FS,1431-2174,NA,contrasting no3-n concentration patterns at two karst springs in iowa (usa): insights on aquifer nitrogen storage and delivery
nutrient,WOS:000457952700065,Approaches to evaluating grower irrigation and fertilizer nitrogen amount and timing,AGRICULTURAL WATER MANAGEMENT,NA,213,693-706,MAR 1,2019,"Lo, Tsz Him | Rudnick, Daran R. | Burr, Charles A. | Stockton, Matthew C. | Werle, Rodrigo",Efficiency | Evaluation | Irrigation | Nitrogen | Requirement | UNL-TAPS,10.1016/j.agwat.2018.11.010,NA,HK4SF,0378-3774,NA,approaches to evaluating grower irrigation and fertilizer nitrogen amount and timing
nutrient,WOS:000457478200038,Evaluation of buffer solutions and urea addition for estimating the in vitro digestibility of feeds,JOURNAL OF ANIMAL SCIENCE,2,97,922-931,FEB,2019,"Camacho, Larissa F. | Silva, Tadeu E. | Palma, Malber N. N. | Assuncao, Amanda S. | Rodrigues, Joao P. | Costa e Silva, Luiz Fernando | Detmann, Edenio",ammonia nitrogen | buffering capacity | Kansas buffer | McDougall's buffer | neutral detergent fiber | repeatability,10.1093/jas/sky464,NA,HJ8VM,0021-8812,NA,evaluation of buffer solutions and urea addition for estimating the in vitro digestibility of feeds
nutrient,WOS:000467491400007,"Effects of optical sensing based variable rate nitrogen management on yields, nitrogen use and profitability for cotton",PRECISION AGRICULTURE,3,20,591-610,JUN,2019,"Stefanini, M. | Larson, J. A. | Lambert, D. M. | Yin, X. | Boyer, C. N. | Scharf, P. | Tubana, B. S. | Varco, J. J. | Dunn, D. | Savoy, H. J. | Buschermohle, M. J.",Economics | Nitrogen use efficiency | Normalized difference vegetation index (NDVI) | Real-time nutrient sensing | Variable rate technology,10.1007/s11119-018-9599-9,NA,HX6CK,1385-2256,NA,"effects of optical sensing based variable rate nitrogen management on yields, nitrogen use and profitability for cotton"
nutrient,WOS:000485894300001,Nitrogen application effects on forage sorghum production and nitrate concentration,JOURNAL OF PLANT NUTRITION,20,42,2794-2804,DEC 14,2019,"Holman, Johnathon D. | Obour, Augustine K. | Mengel, David B.",forage nitrate | forage sorghum | nitrogen use efficiency | optimum nitrogen rate,10.1080/01904167.2019.1659321,NA,JH6BV,0190-4167,NA,nitrogen application effects on forage sorghum production and nitrate concentration
nutrient,WOS:000472698600012,Quantity and quality of water percolating below the root zone of three biofuel feedstock crop systems,AGRICULTURAL WATER MANAGEMENT,NA,221,109-119,JUL 20,2019,"Stenjem, Ryan S. | Thompson, Anita M. | Karthikeyan, K. G. | Lepore, Brian J. | Kendall, Anthony D. | Hyndman, David W.",Water flux | Nutrient flux | Bioenergy | Nitrate | Phosphorus | Suction lysimeter,10.1016/j.agwat.2019.04.008,NA,IE9MN,0378-3774,NA,quantity and quality of water percolating below the root zone of three biofuel feedstock crop systems
nutrient,WOS:000467402500001,Nitrogen Fertilizer Suppresses Mineralization of Soil Organic Matter in Maize Agroecosystems,FRONTIERS IN ECOLOGY AND EVOLUTION,NA,7,,MAR 13,2019,"Mahal, Navreet K. | Osterholz, William R. | Miguez, Fernando E. | Poffenbarger, Hanna J. | Sawyer, John E. | Olk, Daniel C. | Archontoulis, Sotirios, V | Castellano, Michael J.",fertilizer nitrogen use efficiency | N mineralization | priming effect | agronomic optimum N rate | synthetic N fertilizer | continuous maize system,10.3389/fevo.2019.00059,NA,HX4WV,2296-701X,NA,nitrogen fertilizer suppresses mineralization of soil organic matter in maize agroecosystems
nutrient,WOS:000467795900007,Perceptions of Precision Agriculture Technologies in the US Fresh Apple Industry,HORTTECHNOLOGY,2,29,151-162,APR,2019,"Gallardo, R. Karina | Grant, Kara | Brown, David J. | McFerson, James R. | Lewis, Karen M. | Einhorn, Todd | Sazo, Mario Miranda",Malus domestica | technology adoption | tree fruit,10.21273/HORTTECH04214-18,NA,HY0IX,1063-0198,NA,perceptions of precision agriculture technologies in the us fresh apple industry
nutrient,WOS:000455207300021,Soil Quality and Region Influence Performance and Ranking of Switchgrass Genotypes,CROP SCIENCE,1,59,221-232,JAN-FEB,2019,"Casler, M. D. | Sosa, S. | Boe, A. R. | Bonos, S. A.",,10.2135/cropsci2018.06.0409,NA,HG7WR,0011-183X,NA,soil quality and region influence performance and ranking of switchgrass genotypes
nutrient,WOS:000475571300004,Design and field evaluation of a ground robot for high-throughput phenotyping of energy sorghum,PRECISION AGRICULTURE,4,20,697-722,AUG,2019,"Young, Sierra N. | Kayacan, Erkan | Peschel, Joshua M.",Agricultural robotics | Field-based phenotyping | Plant imaging | Sorghum,10.1007/s11119-018-9601-6,NA,IJ0DU,1385-2256,NA,design and field evaluation of a ground robot for high-throughput phenotyping of energy sorghum
nutrient,WOS:000466840400005,Impacts of Nitrogen Rate and Landscape Position on Soils and Switchgrass Root Growth Parameters,AGRONOMY JOURNAL,3,111,1046-1059,MAY-JUN,2019,"Kumar, Sandeep | Lai, Liming | Kumar, Pardeep | Feliciano, Yashira Marie Valentin | Battaglia, Martin Leonardo | Hong, Chang Oh | Owens, Vance N. | Fike, John | Farris, Rodney | Galbraith, John",,10.2134/agronj2018.08.0483,NA,HW6ZV,0002-1962,NA,impacts of nitrogen rate and landscape position on soils and switchgrass root growth parameters
nutrient,WOS:000488143100011,"Assessment of digital technology adoption and access barriers among crop, dairy and livestock producers in Wisconsin",COMPUTERS AND ELECTRONICS IN AGRICULTURE,NA,165,,OCT,2019,"Drewry, Jessica L. | Shutske, John M. | Trechter, David | Luck, Brian D. | Pitman, Lynn",Agricultural data | Broadband access | Internet | Smartphone applications | Technology adoption | Technology barriers,10.1016/j.compag.2019.104960,NA,JA9AT,0168-1699,NA,"assessment of digital technology adoption and access barriers among crop, dairy and livestock producers in wisconsin"
nutrient,WOS:000495460400016,"Performance of AquaCrop model in simulating maize growth, yield, and evapotranspiration under rainfed, limited and full irrigation",AGRICULTURAL WATER MANAGEMENT,NA,223,,AUG 20,2019,"Sandhu, Rupinder | Irmak, Suat",AquaCrop calibration/validation | Canopy cover | Biomass | Soil-water | Evapotranspiration | Limited irrigation | Maize yield | Model performance,10.1016/j.agwat.2019.105687,NA,JL3VN,0378-3774,NA,"performance of aquacrop model in simulating maize growth, yield, and evapotranspiration under rainfed, limited and full irrigation"
nutrient,WOS:000470950200001,Effects of nitrogen rate and harvest time on biomass yield and nutrient cycling of switchgrass and soil nitrogen balance in a semiarid sandy wasteland,INDUSTRIAL CROPS AND PRODUCTS,NA,136,1-10,SEP 15,2019,"Ameen, Asif | Liu, Jintong | Han, Lipu | Xie, Guang Hui",Biomass energy | Management practices | Biomass yield and quality | Crop nutrient uptake | N-use efficiency | Apparent soil nitrogen balance,10.1016/j.indcrop.2019.04.066,NA,IC4QK,0926-6690,NA,effects of nitrogen rate and harvest time on biomass yield and nutrient cycling of switchgrass and soil nitrogen balance in a semiarid sandy wasteland
nutrient,WOS:000446980300010,Effect of previous soil management on sugarcane response to nitrogen fertilization,SCIENTIA AGRICOLA,1,76,72-81,JAN-FEB,2019,"Otto, Rafael | Mariano, Eduardo | Mulvaney, Richard Lesley | Khan, Saeed Ahmad | Boschiero, Beata Nastaro | Tenelli, Sarah | Ocheuze Trivelin, Paulo Cezar",Saccharum spp. | Illinois Soil N Test | inorganic N | vinasse | mineralization,10.1590/1678-992X-2017-0147,NA,GW5MU,1678-992X,NA,effect of previous soil management on sugarcane response to nitrogen fertilization
nutrient,WOS:000485719700023,Toward a Regional Phosphorus (Re) cycle in the US Midwest,JOURNAL OF ENVIRONMENTAL QUALITY,5,48,1397-1413,SEP-OCT,2019,"Margenot, Andrew J. | Kitt, Dianna | Gramig, Benjamin M. | Berkshire, Taylor B. | Chatterjee, Neha | Hertzberger, Allan J. | Aguiar, Sammy | Furneaux, Aliza | Sharma, Navneet | Cusick, Roland D.",,10.2134/jeq2019.02.0068,NA,IX5JE,0047-2425,NA,toward a regional phosphorus (re) cycle in the us midwest
nutrient,WOS:000474848500011,Farmer and Farmland Owner Views on Spatial Targeting for Soil Conservation and Water Quality,WATER RESOURCES RESEARCH,5,55,3796-3814,MAY,2019,"Zimmerman, E. K. | Tyndall, J. C. | Schulte, L. A. | Larsen, G. L. D.",,10.1029/2018WR023230,NA,IH9TE,0043-1397,NA,farmer and farmland owner views on spatial targeting for soil conservation and water quality
nutrient,WOS:000447095700001,Apparent electrical conductivity predicts physical properties of coarse soils,GEODERMA,NA,335,1-11,FEB 1,2019,"Nocco, Mallika A. | Ruark, Matthew D. | Kucharik, Christopher J.",Apparent electrical conductivity | Electromagnetic induction | Proximal sensing | Coarse-textured soils | Glaciolacustrine | Quantile regression,10.1016/j.geoderma.2018.07.047,NA,GW6TR,0016-7061,NA,apparent electrical conductivity predicts physical properties of coarse soils
nutrient,WOS:000496011700001,"Precision medicine, agriculture, and genome editing: science and ethics",ANNALS OF THE NEW YORK ACADEMY OF SCIENCES,NA,NA,,NOV 13,2019,"Moscoso, Carlos G. | Potz, Kelly R. | Tan, Shaoyuan | Jacobson, Pamala A. | Berger, Kavita M. | Steer, Clifford J.",precision medicine | genome editing | bioinformatics | precision oncology | pharmacogenomics | bioethics | public health,10.1111/nyas.14266,NA,JM1WD,0077-8923,NA,"precision medicine, agriculture, and genome editing: science and ethics"
nutrient,WOS:000459944400118,"UAV-Based High Resolution Thermal Imaging for Vegetation Monitoring, and Plant Phenotyping Using ICI 8640 P, FLIR Vue Pro R 640, and thermoMap Cameras",REMOTE SENSING,3,11,,FEB 1,2019,"Sagan, Vasit | Maimaitijiang, Maitiniyazi | Sidike, Paheding | Eblimit, Kevin | Peterson, Kyle T. | Hartling, Sean | Esposito, Flavio | Khanal, Kapil | Newcomb, Maria | Pauli, Duke | Ward, Rick | Fritschi, Felix | Shakoor, Nadia | Mockler, Todd",thermal imaging | ICI 8640 P-series | FLIR Vue Pro R 640 | thermoMap | Unmanned Aerial Vehicles | vegetation monitoring | plant phenotyping | heritability analysis,10.3390/rs11030330,NA,HN1JX,NA,NA,"uav-based high resolution thermal imaging for vegetation monitoring, and plant phenotyping using ici 8640 p, flir vue pro r 640, and thermomap cameras"
nutrient,WOS:000469952600002,"Coarse root biomass and architecture of hybrid aspen 'Crandon' (Populus alba L. x P. grandidenta Michx.) grown in an agroforestry system in central Iowa, USA",JOURNAL OF SUSTAINABLE FORESTRY,1,38,18-30,NA,2019,"Headlee, William L. | Zalesny, Ronald S., Jr. | Hall, Richard B.",Biomass allocation | fertilizer | pipe theory | root geometry | topography,10.1080/10549811.2018.1491861,NA,IB0ML,1054-9811,NA,"coarse root biomass and architecture of hybrid aspen 'crandon' (populus alba l. x p. grandidenta michx.) grown in an agroforestry system in central iowa, usa"
nutrient,WOS:000465366100007,Lessons learned from using a decision-support tool for precision placement of conservation practices in six agricultural watersheds in the US midwest,JOURNAL OF ENVIRONMENTAL MANAGEMENT,NA,239,57-65,JUN 1,2019,"Ranjan, Pranay | Singh, Ajay S. | Tomer, Mark D. | Lewandowski, Ann M. | Prokopy, Linda S.",Decision support tools | Agricultural conservation planning framework | Policy recommendations | Disproportionality | Conservation targeting,10.1016/j.jenvman.2019.03.031,NA,HU6CK,0301-4797,NA,lessons learned from using a decision-support tool for precision placement of conservation practices in six agricultural watersheds in the us midwest
nutrient,WOS:000471294700011,"Evaluation of spray pattern uniformity using three unique analyses as impacted by nozzle, pressure, and pulse-width modulation duty cycle",PEST MANAGEMENT SCIENCE,7,75,1875-1886,JUL,2019,"Butts, Thomas R. | Luck, Joe D. | Fritz, Bradley K. | Hoffmann, W. Clint | Kruger, Greg R.",application technology | average percent error | coefficient of variation | pesticide application optimization | root mean square error,10.1002/ps.5352,NA,IC9IC,1526-498X,NA,"evaluation of spray pattern uniformity using three unique analyses as impacted by nozzle, pressure, and pulse-width modulation duty cycle"
nutrient,WOS:000463981800016,Switchgrass as forage and biofuel feedstock: Effect of nitrogen fertilization rate on the quality of biomass harvested in late summer and early fall,FIELD CROPS RESEARCH,NA,235,154-162,APR 1,2019,"Ameen, Asif | Tang, Chaochen | Liu, Jintong | Han, Lipu | Xie, Guang Hui",Sandy wasteland | Nitrogen rate | Harvest time | Biomass quality | Theoretical ethanol yield | Soil NO3- content,10.1016/j.fcr.2019.03.009,NA,HS6KW,0378-4290,NA,switchgrass as forage and biofuel feedstock: effect of nitrogen fertilization rate on the quality of biomass harvested in late summer and early fall
nutrient,WOS:000467513000009,"NU-Spidercam: A large-scale, cable-driven, integrated sensing and robotic system for advanced phenotyping, remote sensing, and agronomic research",COMPUTERS AND ELECTRONICS IN AGRICULTURE,NA,160,71-81,MAY,2019,"Bai, Geng | Ge, Yufeng | Scoby, David | Leavitt, Bryan | Stoerger, Vincent | Kirchgessner, Norbert | Irmak, Suat | Graef, George | Schnable, James | Awada, Tala",Image analysis | Multispectral imagery | Thermal infrared imagery | LiDAR | Reflectance spectra,10.1016/j.compag.2019.03.009,NA,HX6KR,0168-1699,NA,"nu-spidercam: a large-scale, cable-driven, integrated sensing and robotic system for advanced phenotyping, remote sensing, and agronomic research"
nutrient,WOS:000456278600005,Integration of hydrogeophysical datasets and empirical orthogonal functions for improved irrigation water management,PRECISION AGRICULTURE,1,20,78-100,FEB,2019,"Finkenbiner, Catherine E. | Franz, Trenton E. | Gibson, Justin | Heeren, Derek M. | Luck, Joe",Water use efficiency | Soil hydraulic parameters | Irrigation management | Soil spatial variability,10.1007/s11119-018-9582-5,NA,HI2MF,1385-2256,NA,integration of hydrogeophysical datasets and empirical orthogonal functions for improved irrigation water management
nutrient,WOS:000462540400030,Improving In-Situ Estimation of Soil Profile Properties Using a Multi-Sensor Probe,SENSORS,5,19,,MAR 1,2019,"Pei, Xiaoshuai | Sudduth, Kenneth A. | Veum, Kristen S. | Li, Minzan",diffuse reflectance spectroscopy | precision agriculture | profile soil properties | proximal soil sensing | in-situ sensing,10.3390/s19051011,NA,HQ6PO,1424-8220,NA,improving in-situ estimation of soil profile properties using a multi-sensor probe
nutrient,WOS:000477912900003,Species composition influences soil nutrient depletion and plant physiology in prairie agroenergy feedstocks,ECOSPHERE,7,10,,JUL,2019,"Sherrard, Mark E. | Elgersma, Kenneth J. | Koos, Jordan M. A. | Kokemuller, Catherine M. | Dietz, Hannah E. | Glidden, Alec J. | Carr, Christina M. | Cambardella, Cynthia A.",chlorophyll concentration | leaf N | photosynthesis | prairie agroenergy feedstocks | soil nutrients | switchgrass,10.1002/ecs2.2805,NA,IM3RQ,2150-8925,NA,species composition influences soil nutrient depletion and plant physiology in prairie agroenergy feedstocks
nutrient,WOS:000488143100010,Agricultural drainage tile surveying using an unmanned aircraft vehicle paired with Real-Time Kinematic positioning-A case study,COMPUTERS AND ELECTRONICS IN AGRICULTURE,NA,165,,OCT,2019,"Freeland, Robert | Allred, Barry | Eash, Neal | Martinez, Luis | Wishart, DeBonne",Agricultural drainage | Drainage tiles | Real Time Kinematic (RTK) | Thermal infrared (TIR) | Unmanned aircraft system (UAS),10.1016/j.compag.2019.104946,NA,JA9AT,0168-1699,NA,agricultural drainage tile surveying using an unmanned aircraft vehicle paired with real-time kinematic positioning-a case study
nutrient,WOS:000490629900001,Soil P Storage Capacity in Agricultural Treatment Wetlands: Can a System Designed for N Reduction Also Retain P?,WETLANDS,NA,NA,,OCT 16,2019,"VanZomeren, Christine M. | Berkowitz, Jacob F. | Lemke, A. Maria | Kirkham, Krista G.",Treatment wetland | Soil | Phosphorus | Mehlich-1 | Tile drainage,10.1007/s13157-019-01205-3,NA,JE3YD,0277-5212,NA,soil p storage capacity in agricultural treatment wetlands: can a system designed for n reduction also retain p?
nutrient,WOS:000475697600032,"Navigation of Multiple sUAS Using GNSS, Inertial and Range Radios",PROCEEDINGS OF THE ION 2019 PACIFIC PNT MEETING,NA,NA,402-412,NA,2019,"Huff, Joel | de Haag, Maarten Uijt | Inst Navigat",,10.33012/2019.16814,NA,BN1YA,2329-2849,NA,"navigation of multiple suas using gnss, inertial and range radios"
nutrient,WOS:000461858900019,Three-Dimensional Modeling of the Coevolution of Landscape and Soil Organic Carbon,WATER RESOURCES RESEARCH,2,55,1218-1241,FEB,2019,"Yan, Qina | Le, Phong V. V. | Woo, Dong K. | Hou, Tingyu | Filley, Timothy | Kumar, Praveen",3-D modeling | soil organic carbon | landscape evolution | biogeochemical transformation | anthropogenic influence | critical zone,10.1029/2018WR023634,NA,HP7HO,0043-1397,NA,three-dimensional modeling of the coevolution of landscape and soil organic carbon
nutrient,WOS:000475348700004,Validation of a Commercial Automated Body Condition Scoring System on a Commercial Dairy Farm,ANIMALS,6,9,,JUN,2019,"Mullins, Israel L. | Truman, Carissa M. | Campler, Magnus R. | Bewley, Jeffrey M. | Costa, Joao H. C.",automation | precision dairy farming | BCS camera | dairy management,10.3390/ani9060287,NA,II7CA,2076-2615,NA,validation of a commercial automated body condition scoring system on a commercial dairy farm
